ID,Title_RU,Title_EN,Year,Age_Rating,Runtime,Image_URL,Synopsis,DB_Genres,Countries,Director,Cast,DB_Rating_1,DB_Rating_2,DB_Rating_3,Budget,CSV_Title_RU,CSV_Category_1,CSV_Category_2,CSV_Category_3,CSV_Category_4,CSV_Rating_1,CSV_Rating_2,CSV_Rating_3,Source
937824,Сильнее,,2017,18,119,https://image.openmoviedb.com/kinopoisk-images/1629390/ef560975-d9e5-4a5a-8388-9a261a0a3975/600x900,"История Джеффа Баумана, одного из участников трагических событий на Бостонском марафоне в 2013 году, лишившегося в результате взрывов обеих ног.","['драма', 'биография']",['США'],"[34778, 'Дэвид Гордон Грин']","[[22692, 'Джейк Джилленхол'], [417930, 'Татьяна Маслани'], [21463, 'Миранда Ричардсон'], [1543407, 'Рик Лэйн'], [4302888, 'Нэйт Ричман'], [6157, 'Ленни Кларк'], [4396451, 'Патти О’Нил'], [20802, 'Клэнси Браун'], [4037846, 'Кейт Фицджеральд'], [230139, 'Дэнни Маккарти']]",6.808,6.9,7.0,30000000$,Сильнее,Биографический,Драма,Спортивные легенды,Современное кино (2000–2020),6.808,6.9,7.3,DB & CSV
15216,Леди Гамильтон,,1941,12,120,https://image.openmoviedb.com/kinopoisk-images/9784475/252dc028-9879-438f-941b-0bc49709555c/600x900,"Познакомившись в Неаполе с послом Британии лордом Гамильтоном, Эмма вскоре становится его женой. Он немолод, но знатен, её внешность и манеры великолепны, но прошлое не безупречно. Каждый получил то, на что рассчитывал, но счастья не было.  На одном из светских приёмов Эмма знакомится с Нельсоном. Вспыхнувшая страсть была так сильна, что супруг счёл за благо просто не замечать происходящего. Эмма и Нельсон фактически жили как муж и жена вплоть до его трагической гибели в триумфальной битве при Трафальгаре.","['драма', 'мелодрама', 'военный', 'история']",['США'],"[25005, 'Александр Корда']","[[24974, 'Вивьен Ли'], [45988, 'Лоуренс Оливье'], [198319, 'Алан Маубрэй'], [192133, 'Глэдис Купер'], [197385, 'Хэзер Эйнджел'], [213988, 'Гилберт Эмери'], [189627, 'Рональд Синклер'], [923425, 'Норма Друри Болеславски'], [612011, 'Джульетт Комптон'], [209289, 'Сара Оллгуд']]",7.917,7.2,7.5,,Леди Гамильтон,Биографический,Исторический,Исторические личности,Классика (до 2000 года),7.917,7.2,7.3,DB & CSV
683746,Женщина в золотом,,2015,18,109,https://image.openmoviedb.com/kinopoisk-images/1629390/3dac58f9-0d47-4503-9975-aa2cd69df75b/600x900,"История Марии Альтманн, которая пытается добиться справедливости — вернуть ценности, отобранные у ее семьи нацистами несколько десятилетий назад. Среди культурного достояния женщины известная картина Густава Климта «Портрет Адели Блох-Бауэр», которую иногда называют «Золотая Адель». Вместе с неопытным, но отважным молодым адвокатом, женщина пытается доказать свои права на наследие предков.","['драма', 'история']","['Великобритания', 'США']","[81470, 'Саймон Кёртис']","[[3715, 'Хелен Миррен'], [26612, 'Райан Рейнольдс'], [242467, 'Даниэль Брюль'], [9943, 'Кэти Холмс'], [417930, 'Татьяна Маслани'], [673440, 'Макс Айронс'], [32594, 'Чарльз Дэнс'], [48130, 'Элизабет Макговерн'], [15074, 'Джонатан Прайс'], [802776, 'Антье Трауэ']]",7.367,7.3,6.9,11000000$,Женщина в золотом,Биографический,Драма,Исторические личности,Современное кино (2000–2020),7.367,7.3,6,DB & CSV
842551,Дочь Бога,Daughter of God,2015,18,102,https://image.openmoviedb.com/kinopoisk-images/1600647/2fed2063-550d-4535-83e7-e860ddff0b8a/600x900,"В метро происходит жуткое преступление: убит детектив по имени Джошуа. За поиски убийцы берется его напарник, Скотт Галбан. Возле трупа лежал фотоаппарат, снимки на котором Скотт смотрит постоянно, пытаясь найти зацепку. Он находит свидетелей, но убийца быстрее: свидетели умирают один за другим до беседы со Скоттом. Осталась лишь Изабель, которая видела убийство, а теперь боится смерти.","['триллер', 'драма', 'криминал', 'детектив']",['США'],"[1062566, 'Ги Малик Линтон']","[[816210, 'Ана де Армас'], [2079682, 'Гейб Варгас'], [2763172, 'Сэнди Техада'], [3729478, 'Венус Эриель'], [2886606, 'Эриель Р. Пачеко'], [2122170, 'Исмаэль Крус Кордова'], [9513, 'Энтони Руис'], [4296293, 'Стивен Томпсон'], [7836, 'Киану Ривз'], [9850, 'Мира Сорвино']]",4.695,4.4,4.0,,Дочь Бога,Биографический,Исторический,Исторические личности,Новинки (2020–2025),4.695,4.4,2.9,DB & CSV
565162,Пётр Первый. Завещание,Petr Perviy. Zaveshanie,2011,18,,https://image.openmoviedb.com/kinopoisk-images/1777765/221cdb5b-d2aa-4dd6-b81f-2699c9b55980/600x900,"Фильм рассказывает о двух последних годах жизни императора, о его последней любви. На закате своей жизни Петр Первый полюбил женщину моложе его на 30 лет, княжну Марию Кантемир, бывшую одной из самых образованных дам своего времени. Она готовилась стать матерью его ребенка, императрицей. Но козни, интриги двора, безвременная смерть императора не дали этому осуществиться...","['драма', 'история']",['Россия'],"[256810, 'Владимир Бортко']","[[56447, 'Александр Балуев'], [690012, 'Елизавета Боярская'], [64250, 'Сергей Маковецкий'], [231195, 'Ирина Розанова'], [122791, 'Александр Филиппенко'], [238512, 'Михаил Боярский'], [171589, 'Сергей Шакуров'], [251229, 'Анна Ковальчук'], [1079049, 'Валерий Соловьев'], [1557693, 'Валерий Гришко']]",7.351,6.4,6.9,2750000$,Петр Первый,Биографический,Исторический,Исторические личности,Классика (до 2000 года),7.351,6.4,0,DB & CSV
464,Человек-слон,,1980,18,125,https://image.openmoviedb.com/kinopoisk-images/4486454/fe40af8c-f077-4280-b408-4a71dd0ad95c/600x900,"Доктор Тривз находит Джона Меррика в шоу уродцев. Внешность его настолько ужасающая, что ему приходится носить просторное одеяние, чтобы никто не увидел его пугающих наростов по всему телу. Забрав Меррика в больницу после очередного избиения хозяином, Тривз с удивлением обнаруживает в нем человека интеллектуально развитого и духовного.","['драма', 'биография']","['США', 'Великобритания']","[22174, 'Дэвид Линч']","[[8968, 'Энтони Хопкинс'], [9331, 'Джон Хёрт'], [14594, 'Энн Бэнкрофт'], [14838, 'Джон Гилгуд'], [145921, 'Уэнди Хиллер'], [23202, 'Фредди Джонс'], [34922, 'Майкл Элфик'], [168116, 'Ханна Гордон'], [168605, 'Хелен Райан'], [13196, 'Джон Стэндинг']]",8.112,8.2,8.3,5000000$,Человек-слон,Биографический,Драма,Исторические личности,Классика (до 2000 года),8.112,8.2,8.5,DB & CSV
996027,Игры разумов,,2018,18,124,https://image.openmoviedb.com/kinopoisk-images/1599028/7b4f140a-0f19-4932-b42e-8c5aff750b95/600x900,"Англия середины XIX века. Оксфордский профессор Джеймс Мюррей работает над первым в истории словарем английского языка, а его главным соратником становится заключенный психиатрической клиники для особо опасных преступников — доктор Уильям Майнор.","['драма', 'биография']","['США', 'Ирландия', 'Франция', 'Исландия', 'Мексика', 'Бельгия', 'Великобритания', 'Гонконг']","[965252, 'Фарад Сафиниа']","[[7405, 'Мэл Гибсон'], [1293, 'Шон Пенн'], [2444, 'Эдди Марсан'], [653745, 'Натали Дормер'], [27577, 'Дженнифер Эль'], [41938, 'Стив Куган'], [36298, 'Стивен Диллэйн'], [4543, 'Йоан Гриффит'], [2215254, 'Джереми Ирвин'], [51406, 'Лоуренс Фокс']]",7.327,7.2,6.7,25000000$,Игры разумов,Биографический,Драма,Ученые и изобретатели,Современное кино (2000–2020),7.327,7.2,5.5,DB & CSV
4664634,Оппенгеймер,Gadget,2023,,180,https://image.openmoviedb.com/kinopoisk-images/4486454/c5292109-642c-4ab0-894a-cc304e1bcec4/600x900,"История жизни американского физика-теоретика Роберта Оппенгеймера, который во времена Второй мировой войны руководил Манхэттенским проектом — секретными разработками ядерного оружия.","['биография', 'драма', 'история']","['США', 'Великобритания']","[41477, 'Кристофер Нолан']","[[5005, 'Киллиан Мерфи'], [227068, 'Эмили Блант'], [6458, 'Мэтт Дэймон'], [10096, 'Роберт Дауни мл.'], [3435612, 'Флоренс Пью'], [206, 'Джош Хартнетт'], [8890, 'Дэвид Крамхолц'], [702326, 'Бенни Сэфди'], [1217737, 'Олден Эренрайк'], [8886, 'Кеннет Брана']]",8.098,8.3,8.3,100000000$,Оппенгеймер,Биографический,Драма,Ученые и изобретатели,Новинки (2020–2025),8.098,8.3,8.6,DB & CSV
842881,One Direction: Где мы сейчас,One Direction: Where We Are - Live From San Siro Stadium,2014,6,75,https://image.openmoviedb.com/kinopoisk-images/1898899/dd79f485-b1b1-4bbd-9811-9942a3ce78be/600x900,"В фильме представлена запись живого концерта на легендарном стадионе Сан-Сиро в Милане, где прозвучали все хиты One Direction – от ‘What Makes You Beautiful’ до ‘Story Of My Life’, а также эксклюзивное интервью с участниками группы, нигде прежде не показывавшееся.","['музыка', 'концерт', 'документальный']",['Великобритания'],"[2704869, 'Пол Дагдейл']","[[2501529, 'Гарри Стайлс'], [2705118, 'Луи Томлинсон'], [2021218, 'Лиам Пейн'], [2501549, 'Зейн Малик'], [2501644, 'Найл Хоран'], [3014663, 'Саймон Брайант'], [2904912, 'Том Уотсон'], [1298518, 'Джим Парсонс'], [3306025, 'Альфред Чабб'], [3495751, 'Хезер Гринвуд']]",7.894,6.9,7.4,,One Direction: Где мы сейчас,Биографический,Семейный,Творческие гении,Современное кино (2000–2020),7.894,6.9,0,DB & CSV
374,Бешеный бык,,1980,16,129,https://image.openmoviedb.com/kinopoisk-images/1704946/3f51ec5f-356a-4192-a1f3-1f0097019f00/600x900,"Джейк ЛаМотта, получивший прозвище Бронксский Бык, - боксер. И все его психологические и сексуальные комплексы яростно извергаются на боксерском ринге. Под горячую руку ему попадается родной брат, ставший жертвой навязчивой паранойи и ревности Джейка, а также пятнадцатилетняя девочка, которой суждено было стать самой главной наградой Джейка... и преследующим его наваждением.","['драма', 'биография', 'спорт']",['США'],"[10988, 'Мартин Скорсезе']","[[718, 'Роберт Де Ниро'], [9846, 'Кэти Мориарти'], [63985, 'Джо Пеши'], [6550, 'Фрэнк Винсент'], [168522, 'Николас Коласанто'], [132306, 'Тереса Сальдана'], [162386, 'Марио Галло'], [22418, 'Фрэнк Адонис'], [41652, 'Джозеф Боно'], [168523, 'Фрэнк Топхэм']]",7.766,8.1,8.3,18000000$,Бешеный бык,Биографический,Драма,Спортивные легенды,Классика (до 2000 года),7.766,8.1,9,DB & CSV
843831,Сноуден,,2016,18,134,https://image.openmoviedb.com/kinopoisk-images/1629390/f801c82b-9506-47eb-baa4-f80cc42f3feb/600x900,"Он мечтал продолжить семейную традицию и посвятить свою жизнь служению Родине. Он безоговорочно верил в правительство США и поддерживал антитеррористическую программу. На заре его карьеры в спецслужбах никто, даже он сам, не мог бы предположить, что именно он, Эдвард Сноуден, совершит самое крупное разоблачение в мировой истории, обнародовав секретные документы, касающиеся тотальной слежки США за своими гражданами и гражданами других государств.     Открыв миру глаза на правду, он навсегда закрыл для себя двери в счастливое будущее: отказался от карьеры, любимой девушки и Родины, которая назвала его предателем...","['триллер', 'драма', 'криминал', 'биография']","['США', 'Германия', 'Франция']","[23573, 'Оливер Стоун']","[[9867, 'Джозеф Гордон-Левитт'], [1004809, 'Шейлин Вудли'], [32893, 'Мелисса Лео'], [1130276, 'Закари Куинто'], [4545, 'Том Уилкинсон'], [1107477, 'Скотт Иствуд'], [7629, 'Рис Иванс'], [6793, 'Николас Кейдж'], [3424, 'Тимоти Олифант'], [38556, 'Джеймс Батлер']]",7.191,7.3,6.9,40000000$,Сноуден,Биографический,Триллер,Ученые и изобретатели,Современное кино (2000–2020),7.191,7.3,6.2,DB & CSV
402542,Джули и Джулия: Готовим счастье по рецепту,Julie and Julia,2009,12,123,https://image.openmoviedb.com/kinopoisk-images/1599028/ded76de1-78bd-43cb-89c1-047e4772e8ab/600x900,"Джули Пауэлл - начинающая писательница и оператор call-центра. Чтобы отвлечься от работы, она ставит перед собой цель: приготовить за год 524 блюда из знаменитой книги Джулии Чайлд «Осваивая искусство французской кухни».","['драма', 'мелодрама', 'биография']",['США'],"[6477, 'Нора Эфрон']","[[23100, 'Мэрил Стрип'], [28630, 'Эми Адамс'], [12028, 'Стэнли Туччи'], [12802, 'Крис Мессина'], [3110, 'Линда Эмонд'], [27659, 'Хелен Кэри'], [9714, 'Мэри Линн Райскаб'], [13668, 'Джейн Линч'], [198682, 'Джоан Бак'], [1741325, 'Кристал Ноэль']]",7.629,7.0,7.1,40000000$,Джули и Джулия: Готовим счастье по рецепту,Биографический,Комедия,Творческие гении,Современное кино (2000–2020),7.629,7,6.7,DB & CSV
24198,Модильяни,,2004,18,128,https://image.openmoviedb.com/kinopoisk-images/1600647/9256bab7-99f8-47f4-acaa-afd89b1fc9ac/600x900,"1919 год. Война закончилась, и ночная жизнь Парижа полна страсти и неконтролируемых желаний. В кафе «Ротонда», штаб-квартире художественной элиты, мы находим столик, которому нет равного в истории: за ним сидят Пикассо, Ривера, Кокто, Сутин, Утрилло и Модильяни.  Это нерассказанная история о жестоком соперничестве между Модильяни и Пикассо. Между двумя людьми, чья зависть друг к другу подпитывается их талантом, их высокомерием, их страстями. Кроме того, это история величайшей трагической любви в истории искусства…","['драма', 'биография']","['Великобритания', 'Германия', 'Румыния', 'Франция', 'Италия']","[79320, 'Майкл Дэвис']","[[8369, 'Энди Гарсиа'], [59368, 'Эльза Зильберштейн'], [10031, 'Омид Джалили'], [131854, 'Ипполит Жирардо'], [1325, 'Удо Кир'], [44922, 'Питер Капальди'], [460190, 'Луис Хилиер'], [122419, 'Стивен Римкус'], [26820, 'Дан Астилеану'], [44423, 'Георге Иваску']]",7.822,7.2,6.2,14000000$,Модильяни,Биографический,Драма,Творческие гении,Современное кино (2000–2020),7.822,7.2,3.7,DB & CSV
1113938,Роберт — король Шотландии,,2019,18,124,https://image.openmoviedb.com/kinopoisk-images/4303601/b73ec12f-cd2f-4888-b1e6-b50d4917c5d0/600x900,"Для одних он беглый преступник, дли других — доблестный воин. История о легендарном дворянине, который бросил вызов целой империи и повел за собой народ, чтобы сражаться за свободу. В сердцах многих он останется истинным королем Шотландии. И имя его — Роберт Брюс.","['драма', 'военный', 'биография', 'история']","['США', 'Австралия', 'Великобритания']","[1940067, 'Ричард Грэй']","[[2110, 'Энгус Макфадьен'], [1848145, 'Дирмед Мёрта'], [1402, 'Джаред Харрис'], [4437722, 'Стивен Мерфи'], [2895045, 'Гэбриел Бейтман'], [1587863, 'Анна Хатчисон'], [2895044, 'Талита Бейтман'], [4628153, 'Брэндон Лессард'], [2805449, 'Джуда Нельсон'], [7223, 'Патрик Фьюджит']]",6.358,5.5,5.9,,Роберт — король Шотландии,Биографический,Исторический,Исторические личности,Современное кино (2000–2020),6.358,5.5,0,DB & CSV
607152,Пятая власть,The Man Who Sold the World,2013,18,128,https://image.openmoviedb.com/kinopoisk-images/6201401/dfcff69e-2ee1-4eb9-bfb2-da1b8a7d1b97/600x900,"В мире, где информация ценится превыше всего, а утечка сведений под грифом «секретно» может вызвать необратимые последствия, сайт WikiLeaks навсегда поменял правила игры. Фильм, основанный на реальных событиях, рассказывает о попытке разоблачить государственную коррупцию и ложь властей, которая превратила интернет-стартап в одну из самых известных и обсуждаемых организаций 21-го века. За первые годы существования WIKILEAKS обнародовал больше тайн, чем самые влиятельные в мире СМИ вместе взятые, раскрывая постыдные секреты государственных служб и финансовые преступления корпораций. Но когда основатели сайта получили доступ к крупнейшему засекреченному архиву США, им предстояло найти для себя ответ на один из важнейших вопросов современности: какова цена тайны в свободном обществе - и какова цена ее разглашения?","['триллер', 'драма', 'криминал', 'биография']","['США', 'Индия', 'Бельгия']","[36063, 'Билл Кондон']","[[34549, 'Бенедикт Камбербэтч'], [242467, 'Даниэль Брюль'], [14362, 'Дэвид Тьюлис'], [1323290, 'Алисия Викандер'], [10965, 'Лора Линни'], [12028, 'Стэнли Туччи'], [32208, 'Энтони Маки'], [44922, 'Питер Капальди'], [52224, 'Мориц Бляйбтрой'], [1823805, 'Джейми Блэкли']]",6.574,6.2,6.1,28000000$,Пятая власть,Биографический,Драма,Исторические личности,Современное кино (2000–2020),6.574,6.2,5.4,DB & CSV
807401,Джастин Бибер. Believe,,2013,6,90,https://image.openmoviedb.com/kinopoisk-images/1599028/e53adb5a-304c-481c-9088-70f8e187f6ae/600x900,"Фильм, снятый во время концертного тура Believe. Прикоснись к настоящему Джастину Биберу – эмоциональному, откровенному, переживающему взлеты и падения. Пройди вместе с ним путь от аутсайдера, мечтавшего выступать в самом престижном зале Нью-Йорка, до крупнейшей поп-звезды планеты.","['концерт', 'музыка', 'документальный']",['США'],"[111697, 'Джон М. Чу']","[[1828076, 'Джастин Бибер'], [2309491, 'Скутер Браун'], [2378084, 'Райан Гуд'], [25190, 'Ашер'], [2942004, 'Пэтти Маллетт'], [2378090, 'Джереми Бибер'], [2357130, 'Майк Познер'], [615574, 'Макс Мартин'], [696643, 'Уилл Ай Эм'], [476365, 'Родни Джеркинс']]",1.589,1.6,2.8,5000000$,Джастин Бибер: Believe,Биографический,Семейный,Творческие гении,Современное кино (2000–2020),1.589,1.6,5.1,DB & CSV
