ID,Title_RU,Title_EN,Year,Age_Rating,Runtime,Image_URL,Synopsis,DB_Genres,Countries,Director,Cast,DB_Rating_1,DB_Rating_2,DB_Rating_3,Budget,CSV_Title_RU,CSV_Category_1,CSV_Category_2,CSV_Category_3,CSV_Category_4,CSV_Rating_1,CSV_Rating_2,CSV_Rating_3,Source
1046057,Молоко,,2021,18,119,https://image.openmoviedb.com/kinopoisk-images/10671298/a9454ce4-4027-46b2-9e02-6476858e62e5/600x900,"Жителей города Кировска давно не удивить красотой северного сияния. Однажды именно благодаря ему простая девушка Зоя получает фантастический дар — магическую силу, способную менять судьбы людей.","['драма', 'фантастика', 'комедия']",['Россия'],"[1209592, 'Карен Оганесян']","[[1537279, 'Юлия Пересильд'], [231278, 'Гоша Куценко'], [1769503, 'Андрей Бурковский'], [230534, 'Юрий Колокольников'], [304561, 'Елена Валюшкина'], [6120045, 'Эрик Панич'], [6052696, 'Егор Абрамов'], [2383487, 'Евгения Каверау'], [5725688, 'Ирина Воронова'], [6625029, 'Артем Первых']]",6.777,0.0,6.8,,Молоко,Биографический,Драма,Исторические личности,Современное кино (2000–2020),6.777,0,0,DB & CSV
505796,Дж. Эдгар,Hoover,2011,18,137,https://image.openmoviedb.com/kinopoisk-images/1599028/38ed37b6-f05b-44a4-be58-5422055ff7b2/600x900,"В течение всей жизни Джон Эдгар Гувер поднимался к вершинам власти, чтобы стать самым могущественным человеком в Америке. Будучи главой Федерального бюро расследований, он ни перед чем не останавливался, чтобы защитить свою страну. Пережив восемь президентов и три войны, Гувер вел сражения с угрозами как реальными, так и надуманными, зачастую нарушая правила, чтобы уберечь сограждан от опасности. Он был безжалостен и был героем, причем одновременно; мир восхищался им, что было для него самой желанной, пусть и не материальной, наградой.  «Дж. Эдгар» глазами самого Гувера показывает нам его частную и общественную жизнь и отношения с окружающими человека, который мог с тем же успехом исказить правду, с каким он защищал ее в течение всей своей жизни, посвященной воплощению его собственной идеи","['драма', 'мелодрама', 'биография']",['США'],"[22948, 'Клинт Иствуд']","[[37859, 'Леонардо ДиКаприо'], [1121926, 'Арми Хаммер'], [27221, 'Наоми Уоттс'], [6240, 'Джуди Денч'], [3418, 'Дермот Малруни'], [10974, 'Джош Лукас'], [33673, 'Майлз Фишер'], [12170, 'Джош Хэмилтон'], [2641, 'Джеффри Пирсон'], [95988, 'Шерил Лосон']]",6.679,6.5,6.3,35000000$,Дж. Эдгар,Биографический,Исторический,Исторические личности,Современное кино (2000–2020),6.679,6.5,5.7,DB & CSV
1115446,Роналду против Месси,,2017,6,70,https://image.openmoviedb.com/kinopoisk-images/1898899/8cba164d-d1e6-4f20-bb4d-805bdb0da126/600x900,"Футбольный мир разделен на два противоборствующих лагеря: на тех, кто болеет за Криштиану Роналду, и тех, кто отдает предпочтение Лионелю Месси. Эксперты сравнивают то, как воспитывались два этих величайших спортсмена, их карьеру, талант и мастерство, результативность на поле и конкурентоспособность за его пределами. Неистовые и преданные фанаты футболистов, их коллеги и соперники, журналисты участвуют в жаркой дискуссии, чтобы определить, кто же лучший из лучших…","['документальный', 'спорт', 'биография']",['Великобритания'],"[730972, 'Тара Пирниа']","[[1553583, 'Криштиану Роналду'], [2317372, 'Лионель Месси'], [37321, 'Дэвид Бекхэм'], [1286924, 'Алекс Фергюсон'], [2317373, 'Жерар Пике'], [3764751, 'Риккардо Вальсекки'], [1610415, 'Сепиде Хафтголи'], [3538945, 'Маркус Сирэнк'], [4965321, 'Алена Уокер']]",6.276,5.1,5.7,,Роналду против Месси,Биографический,Драма,Спортивные легенды,Новинки (2020–2025),6.276,5.1,0,DB & CSV
65144,Качая железо,,1976,12,86,https://image.openmoviedb.com/kinopoisk-images/4303601/1028187b-3816-4cab-b6c3-4ee4c70df878/600x900,"«Качая Железо» явил миру двадцативосьмилетнего Арнольда Шварценеггера - пятикратного обладателя титула «Мистер Олимпия», австрийского культуриста, которого книга рекордов Гинесса назовёт «самым идеально сложенным мужчиной за всю историю мира». В этой картине будущая суперзвезда Голливуда будет бороться за свой 6-ой титул «Мистер Олимпия»!","['документальный', 'спорт']",['США'],"[20061, 'Джордж Батлер']","[[6264, 'Арнольд Шварценеггер'], [16221, 'Лу Ферриньо'], [490381, 'Мэтти Ферриньо'], [490382, 'Виктория Ферриньо'], [490383, 'Майк Кац'], [835727, 'Франко Коломбо'], [490380, 'Эд Корни'], [490385, 'Кен Уоллер'], [168292, 'Серж Нюбре'], [490384, 'Робби Робинсон']]",7.892,7.3,7.4,,Качая железо,Биографический,Неважно,Спортивные легенды,Классика (до 2000 года),7.892,7.3,7,DB & CSV
989939,Виктория и Абдул,,2017,12,111,https://image.openmoviedb.com/kinopoisk-images/1599028/2cf18fe6-452e-476b-af20-fb732413223d/600x900,"Взойдя на престол в возрасте 18-ти лет, Виктория стала королевой Великобритании, Ирландии, а позже и императрицей Индии. Среди бесчисленных подданных короны был красавец Абдул Карим. Появившись, казалось бы, из ниоткуда, он превратился в очень влиятельного человека при дворе. Ему завидовали, против него плели интриги, а их отношения с королевой обсуждали не только в Англии, но и во всем мире.","['драма', 'комедия', 'биография', 'история']","['Великобритания', 'США', 'Китай']","[40395, 'Стивен Фрирз']","[[6240, 'Джуди Денч'], [1673203, 'Али Фазал'], [32847, 'Тим Пиготт-Смит'], [23497, 'Эдди Иззард'], [1215672, 'Адиль Ахтар'], [21464, 'Майкл Гэмбон'], [56162, 'Пол Хиггинс'], [14463, 'Оливия Уильямс'], [226351, 'Фенелла Вулгар'], [29736, 'Джулиан Уэдэм']]",6.897,6.8,6.6,,Виктория и Абдул,Биографический,Исторический,Исторические личности,Современное кино (2000–2020),6.897,6.8,6.1,DB & CSV
735178,Сен-Лоран. Стиль – это я,,2014,18,150,https://image.openmoviedb.com/kinopoisk-images/1599028/696ce688-dd6c-4801-9387-b6cd75faead7/600x900,"Конец 1960-х, модный дом молодого Ива Сен-Лорана процветает, а сам дизайнер переживает пьянящий успех и отчаяние. На богемных парижских вечеринках, в Марракеше, в полотнах Уорхолла и книгах Пруста Сен-Лоран ищет и ответы на вопросы, и вдохновение. Но лишь такому утонченному режиссеру, как Бертран Бонелло, удается не только рассказать историю уникального модельера, но и создать портрет эпохи с её диалогами, непомерными развлечениями и умением любой ценой проживать каждый момент жизни красиво.","['драма', 'мелодрама', 'биография']","['Франция', 'Бельгия']","[259404, 'Бертран Бонелло']","[[51963, 'Гаспар Ульель'], [51939, 'Жереми Ренье'], [225973, 'Луи Гаррель'], [1108971, 'Леа Сейду'], [1088938, 'Эмилин Валаде'], [225306, 'Амира Касар'], [43746, 'Миша Лекот'], [128521, 'Хельмут Бергер'], [71765, 'Валерия Бруни-Тедески'], [389405, 'Валери Донзелли']]",6.265,6.1,6.1,8770000€,Сен-Лоран. Стиль — это я,Биографический,Драма,Творческие гении,Современное кино (2000–2020),6.265,6.1,5.9,DB & CSV
42470,Юность Петра,,1980,12,140,https://image.openmoviedb.com/kinopoisk-images/1629390/57077cbc-4ed1-4e69-a81b-99151daee8b4/600x900,"Начало дилогии о российском императоре Петре Великом. Годы отрочества и юности царя были полны для него смертельной опасности, исходившей и от части боярства, и от бунтующих стрельцов, и от стремящейся к власти царевны Софьи. Однако уже в ту пору Петр выказывает глубокий, ясный ум, волю и целеустремленность, которые помогают обезоружить его явных и тайных врагов...","['драма', 'биография', 'история']","['СССР', 'Германия (ГДР)']","[220513, 'Сергей Герасимов']","[[269781, 'Дмитрий Золотухин'], [220509, 'Тамара Макарова'], [185619, 'Наталья Бондарчук'], [238539, 'Николай Ерёменко мл.'], [199935, 'Олег Стриженов'], [290327, 'Вадим Спиридонов'], [307386, 'Михаил Ножкин'], [318086, 'Петер Ройссе'], [320145, 'Ульрика Май'], [297881, 'Эдуард Бочаров']]",8.258,7.2,7.7,,Юность Петра,Биографический,Исторический,Исторические личности,Классика (до 2000 года),8.258,7.2,0,DB & CSV
8076,Девушка с жемчужной сережкой,,2003,16,100,https://image.openmoviedb.com/kinopoisk-images/4486454/8d382fa5-7ca7-45c3-8330-aca2e1553595/600x900,"1665 год, голландский город Дельфт. В дом художника Йоханнеса Вермеера приходит 16-летняя девушка Гриет, чтобы работать служанкой. Вскоре она обращает на себя внимание живописца, потому что, несмотря на свой юный возраст, Гриет тонко чувствует не только результат творчества, но и сам процесс, механизм создания полотен, которым суждено будет жить в веках. Однажды Вермеер обращается с просьбой к Гриет - позировать ему для новой картины...","['драма', 'мелодрама', 'биография']","['Великобритания', 'Люксембург', 'Франция', 'Бельгия', 'США']","[456751, 'Питер Уэббер']","[[3903, 'Скарлетт Йоханссон'], [16464, 'Колин Фёрт'], [31366, 'Эсси Дэвис'], [4545, 'Том Уилкинсон'], [65080, 'Джуди Парфитт'], [5005, 'Киллиан Мерфи'], [456753, 'Джоанна Скэнлэн'], [51106, 'Алакина Манн'], [71710, 'Крис Макхаллем'], [32412, 'Гэбриэлль Рейди']]",7.223,6.9,7.0,,Девушка с жемчужной сережкой,Биографический,Драма,Творческие гении,Современное кино (2000–2020),7.223,6.9,6.9,DB & CSV
485311,Король говорит!,,2010,18,118,https://image.openmoviedb.com/kinopoisk-images/6201401/87b66d75-b407-4f5b-924c-d3d3a9c96933/600x900,"1936 год. После того как его брат отрёкся от престола, герцог Йоркский соглашается на трон. Измученный сильным заиканием и сомнениями в собственных способностях руководить страной, Георг VI обращается за помощью к логопеду по имени Лайонел Лог.","['драма', 'биография', 'история']","['Великобритания', 'США']","[223790, 'Том Хупер']","[[16464, 'Колин Фёрт'], [24683, 'Джеффри Раш'], [25775, 'Хелена Бонем Картер'], [7165, 'Гай Пирс'], [13416, 'Тимоти Сполл'], [96835, 'Энтони Эндрюс'], [21464, 'Майкл Гэмбон'], [72430, 'Клэр Блум'], [10023, 'Дерек Джекоби'], [27577, 'Дженнифер Эль']]",8.057,8.0,8.2,15000000$,Король говорит!,Биографический,Драма,Исторические личности,Современное кино (2000–2020),8.057,8,8.6,DB & CSV
450184,Ласковый май,,2009,18,115,https://image.openmoviedb.com/kinopoisk-images/4303601/16629511-5dc9-4a8e-9046-3256ba571cca/600x900,"В 1985 году в Советском Союзе началась перестройка и появилась группа «Ласковый май». На их концертах были только аншлаги, от неразделенной любви к ним совершались самоубийства. Фигура Михаила Горбачева меркла в лучах славы создателя «Ласкового мая» — Андрея Разина. Случайно сделанная фотография на пляже, где Андрей Разин, будучи ребенком, запечатлен с семьей Горбачевых, перевернула его судьбу. Именно с помощью этой фотографии он стал племянником Горбачева.  Он заявил об этом не впрямую — так, намекнул, и ему мгновенно поверили. Функционеры всех рангов действовали без промедления: перед ним распахнулись двери телевидения и радио, советская эстрада легла к его ногам. Разин ездил по всем детским домам Советского Союза в поисках одаренных детей для своих групп-двойников. «Ласковый май» гастролировал одновременно в нескольких городах, давая в день по 5-6 концертов. За все годы существования группы не было ни одного не проданного или сданного билета, каждый пятый житель СССР побывал на их концертах.","['драма', 'биография']",['Россия'],"[1642321, 'Владимир Виноградов']","[[1384492, 'Вячеслав Манучаров'], [2769383, 'Иван Семенов'], [1079234, 'Максим Литовченко'], [1846148, 'Сергей Романович'], [1568512, 'Пётр Скворцов'], [2328894, 'Данила Чванов'], [915872, 'Инга Оболдина'], [273174, 'Екатерина Федулова'], [139212, 'Людмила Зайцева'], [2971607, 'Кристина Кузнецова']]",6.754,6.1,6.4,4500000$,Ласковый май,Биографический,Комедия,Творческие гении,Современное кино (2000–2020),6.754,6.1,0,DB & CSV
42719,Один шанс из тысячи,,1968,16,81,https://image.openmoviedb.com/kinopoisk-images/1898899/bae1f805-17e3-4d08-bd04-af35f414669e/600x900,"1942 год. Отряд разведчиков-десантников, заброшенный в тыл врага, вырывается из немецкого кольца. Во главе с капитаном Мигунько они добираются до шоссе, где задерживают легковую машину с неким Двигубским, который работает с агентами вражеской разведки. Капитан принимает решение с помощью Двигубского проникнуть в центр вербовки...","['приключения', 'военный']",['СССР'],"[338629, 'Леон Кочарян']","[[174263, 'Анатолий Солоницын'], [337617, 'Александр Фадеев'], [174264, 'Николай Гринько'], [594838, 'Олег Халимонов'], [594839, 'В. Лапин'], [185647, 'Владимир Маренков'], [307401, 'Лев Поляков'], [200917, 'Жанна Прохоренко'], [285850, 'Олег Савосин'], [304033, 'Харий Швейц']]",6.436,6.0,6.2,,Один шанс из тысячи,Биографический,Комедия,Творческие гении,Современное кино (2000–2020),6.436,6,0,DB & CSV
5423,Семь лет в Тибете,,1997,12,136,https://image.openmoviedb.com/kinopoisk-images/1704946/3139dfcb-07f1-43ad-a0cb-c550a6f77ee9/600x900,"Генрих Харрер, офицер Рейха, человек, у которого было все - успех, красота, известность. Но ему было мало земной славы. Оставив дома беременную жену, он отправляется на покорение самого неприступного пика в Гималаях. Этот подвиг должен увековечить его имя.  Однако впереди его ждет не успешное восхождение, а смертельная опасность, вражеский плен, долгие скитания… Наконец он добирается до таинственного тибетского города Лхаса, где ему предстоит провести долгих семь лет, и где молодой Далай Лама делает его своим приближенным. И здесь, в стране, лежащей за границами цивилизации, ему придется пережить события, которые навсегда изменят его жизнь...","['драма', 'приключения', 'военный', 'биография', 'история']","['США', 'Великобритания']","[51597, 'Жан-Жак Анно']","[[25584, 'Брэд Питт'], [14362, 'Дэвид Тьюлис'], [42387, 'Б.Д. Вонг'], [8843, 'Мако'], [74447, 'Дэнни Дензонгпа'], [66730, 'Виктор Вон'], [55248, 'Ингеборга Дапкунайте'], [74448, 'Цзямъян Цзямцо Ванчук'], [74449, 'Лакпа Тсамшо'], [74450, 'Джетсун Пема']]",7.795,7.1,7.0,70000000$,Семь лет в Тибете,Биографический,Приключения,Исторические личности,Классика (до 2000 года),7.795,7.1,6.2,DB & CSV
577211,Несломленный,,2014,18,137,https://image.openmoviedb.com/kinopoisk-images/1599028/669ee917-2fdf-41ea-891d-0aaf99d7a9a2/600x900,"Фильм основан на реальных событиях и рассказывает об американце Луи Замперини, который принимал участие в Олимпийских играх 1936 года в Берлине. Он не одержал победу в финальном забеге, но, по какой-то причине, снискал расположение Гитлера, который пригласил его к себе в ложу. Предполагалось, что Замперини примет участие и в следующих Олимпийских играх, но из-за начала Второй мировой войны он был вынужден отправиться на фронт. Его самолет был сбит над Японией, а сам Замперини попал в плен к японцам, где пережил многочисленные пытки. Домой он вернулся уже лишь после окончания войны.","['биография', 'военный', 'драма', 'история', 'спорт']","['США', 'Япония']","[20866, 'Анджелина Джоли']","[[1074911, 'Джек О’Коннелл'], [671252, 'Донал Глисон'], [1896667, 'Мияви'], [223311, 'Гаррет Хедлунд'], [1216454, 'Финн Уиттрок'], [1507394, 'Джай Кортни'], [1124635, 'Джон Магаро'], [965880, 'Люк Тредэвэй'], [2073291, 'Алекс Расселл'], [1460585, 'Джон Д’Лео']]",7.367,7.2,6.9,65000000$,Несломленный,Биографический,Военный,Спортивные легенды,Современное кино (2000–2020),7.367,7.2,6,DB & CSV
842413,Евгений Леонов. А слезы капали...,,2006,,,,"Евгений Леонов играл комедийные роли. Но актёр с негероической внешностью всю жизнь стремился стать героем. На экране и на сцене. Чем старше он становился, тем упорнее его тянуло к воплощению драматических и даже трагических начал жизни. И это надорвало ему сердце...","['биография', 'документальный']",['Россия'],"[1671916, 'Татьяна Архипцова']","[[343964, 'Евгений Леонов'], [290164, 'Андрей Леонов'], [224537, 'Александр Абдулов'], [122785, 'Александр Збруев'], [284678, 'Елена Шанина'], [294143, 'Марк Захаров'], [74696, 'Александр Лазарев'], [200893, 'Светлана Немоляева'], [273449, 'Андрей Смирнов'], [231224, 'Александр Митта']]",0.0,0.0,0.0,,Евгений Леонов. А слезы капали,Биографический,Драма,Творческие гении,Новинки (2020–2025),0,0,0,DB & CSV
