ID,Title_RU,Title_EN,Year,Age_Rating,Runtime,Image_URL,Synopsis,DB_Genres,Countries,Director,Cast,DB_Rating_1,DB_Rating_2,DB_Rating_3,Budget,CSV_Title_RU,CSV_Category_1,CSV_Category_2,CSV_Category_3,CSV_Category_4,CSV_Rating_1,CSV_Rating_2,CSV_Rating_3,Source
1107,Джон Ф. Кеннеди: Выстрелы в Далласе,,1991,16,181,https://image.openmoviedb.com/kinopoisk-images/1704946/1b7d8c6f-2f21-44fc-b88e-502985f2e04f/600x900,"1963-й год. Весь мир шокирован известием об убийстве президента США Джона Кеннеди в Далласе. Пока вице-президент Линдон Джонсон принимает в самолете присягу на верность американскому народу, полиция задерживает бывшего морского пехотинца Ли Харви Освальда.  Именно ему в скором времени будет предъявлено обвинение в убийстве. Множество несоответствий и ошибок в проведении расследования, а также гибель 12 ключевых свидетелей, приведут к появлению новых версий убийства. Энергичный окружной прокурор Джим Гаррисон проводит собственное расследование, в ходе которого он смог ответить на вопрос: Кто убил президента Кеннеди?","['триллер', 'драма', 'история']","['США', 'Франция']","[23573, 'Оливер Стоун']","[[24087, 'Кевин Костнер'], [6650, 'Гари Олдман'], [7163, 'Томми Ли Джонс'], [7939, 'Кевин Бейкон'], [22177, 'Сисси Спейсек'], [63985, 'Джо Пеши'], [8434, 'Джек Леммон'], [11664, 'Лори Меткаф'], [11362, 'Дональд Сазерленд'], [6266, 'Майкл Рукер']]",7.867,8.0,7.9,40000000$,Джон Ф. Кеннеди: Выстрелы в Далласе,Биографический,Исторический,Исторические личности,Новинки (2020–2025),7.867,8,7.7,DB & CSV
45433,Чайковский,,1970,0,157,https://image.openmoviedb.com/kinopoisk-images/1898899/3a2441fd-d5e1-4908-9a2e-d0b75d7f20f8/600x900,"Рассказывая о наиболее ярких эпизодах жизни великого русского композитора, создатели фильма стремятся передать удивительное своеобразие его мироощущения, приоткрыть завесу тайны, всегда укутывающей творчество гения.","['драма', 'биография']",['СССР'],"[190101, 'Игорь Таланкин']","[[174329, 'Иннокентий Смоктуновский'], [178089, 'Антонина Шуранова'], [176276, 'Кирилл Лавров'], [190103, 'Владислав Стржельчик'], [343964, 'Евгений Леонов'], [181360, 'Майя Плисецкая'], [190104, 'Бруно Фрейндлих'], [181214, 'Алла Демидова'], [190105, 'Евгений Евстигнеев'], [190106, 'Лилия Юдина']]",7.398,6.3,6.8,,Чайковский,Биографический,Драма,Творческие гении,Новинки (2020–2025),7.398,6.3,0,DB & CSV
44488,Гений,,1991,12,162,https://image.openmoviedb.com/kinopoisk-images/1946459/9ece446a-5f4e-4224-8559-fa10cf7956d1/600x900,"В прошлом талантливый физик, а ныне — директор овощного магазина, имеет криминальное хобби. Его изобретательные и технически великолепные операции задевают интересы не только правоохранительных органов, но и мафиозных структур.","['комедия', 'криминал', 'драма']",['СССР'],"[238489, 'Виктор Сергеев']","[[224537, 'Александр Абдулов'], [174329, 'Иннокентий Смоктуновский'], [281273, 'Лариса Белогурова'], [75866, 'Юрий Кузнецов'], [245645, 'Валентина Талызина'], [284380, 'Сергей Проханов'], [200871, 'Анатолий Кузнецов'], [284805, 'Альгис Матулёнис'], [340022, 'Виктор Ильичев'], [273458, 'Виктор Смирнов']]",7.948,7.2,7.6,,Гений,Биографический,Драма,Ученые и изобретатели,Современное кино (2000–2020),7.948,7.2,0,DB & CSV
770973,Вселенная Стивена Хокинга,Travelling to Infinity,2014,18,123,https://image.openmoviedb.com/kinopoisk-images/1599028/9d1f409d-886d-41fb-a532-0296c226d003/600x900,"История большой любви и больших открытий. Молодой студент-физик Стивен Хокинг знакомится с будущим искусствоведом Джейн Уайльд. Стивен подает большие надежды, профессора видят в нем будущее английской космологии. Веселые свидания, прогулки с друзьями, танцы в вечерних огнях и разговоры о физике, Боге и искусстве остаются в прошлом - Хокингу ставят страшный диагноз - болезнь Лу Герига. Его жизнь может оборваться через 2 года, но это не пугает Джейн.","['биография', 'мелодрама', 'драма']","['Великобритания', 'Япония', 'США']","[544469, 'Джеймс Марш']","[[670494, 'Эдди Редмэйн'], [704469, 'Фелисити Джонс'], [226952, 'Чарли Кокс'], [14362, 'Дэвид Тьюлис'], [12557, 'Эмили Уотсон'], [40942, 'Максин Пик'], [22677, 'Саймон Макберни'], [47364, 'Эбигейл Круттенден'], [1056407, 'Гарри Ллойд'], [1225200, 'Майкл Маркус Морган']]",7.939,7.7,7.6,15000000$,Вселенная Стивена Хокинга,Биографический,Драма,Ученые и изобретатели,Современное кино (2000–2020),7.939,7.7,7.3,DB & CSV
44553,Гонщики,,1972,12,80,https://image.openmoviedb.com/kinopoisk-images/4303601/0b26228e-22c9-4fff-9092-898598f1dea4/600x900,"Неприятный инцидент на зимней трассе выливается в конфликт между двумя автогонщиками: стареющим мастером спорта Кукушкиным и его учеником — молодым и амбициозным Сергачёвым. Размолвка приводит к тому, что несмотря на протесты командного тренера, накануне очередных крупных соревнований бывшие напарники оказываются в разных экипажах.",['драма'],['СССР'],"[284219, 'Игорь Масленников']","[[343964, 'Евгений Леонов'], [54829, 'Олег Янковский'], [303859, 'Лариса Лужина'], [127995, 'Армен Джигарханян'], [304336, 'Леонхард Мерзин'], [287568, 'Николай Ферапонтов'], [333137, 'Ольга Ролич'], [333138, 'Андрей Грецов'], [269603, 'Борис Аракелов'], [273363, 'Нина Ильина']]",7.185,6.7,6.9,,Гонщики,Биографический,Драма,Спортивные легенды,Современное кино (2000–2020),7.185,6.7,0,DB & CSV
88153,Победитель,,2006,0,87,https://image.openmoviedb.com/kinopoisk-images/1773646/79903fdc-1682-4801-ad8e-202400d1dffe/600x900,"История, рассказывающая о веселых приключениях озорного  мальчишки Янки Ирвинга  и его  забавных друзей, остроумного  мяча-шутника Скрю  и нахальной биты - примадонны Дорогуши.  Вместе  с ними он следует  за своей  мечтой из Нью-Йорка в великолепный Чикаго, попадая в смешные и каверзные ситуации. А  сила дружбы  и оптимизм помогают  ему привести к победе свою любимую спортивную команду.","['мультфильм', 'фэнтези', 'драма', 'комедия', 'приключения', 'семейный', 'спорт']","['Канада', 'США']","[609547, 'Колин Брэйди']","[[1141157, 'Ричи Аллен'], [648766, 'Джейк Т. Остин'], [724584, 'Чериз Буф'], [1141158, 'Джесси Бронштейн'], [1141159, 'Ральф Коппола'], [28592, 'Брайан Деннехи'], [22266, 'Вупи Голдберг'], [295690, 'Джейсон Харрис'], [466032, 'Эд Хелмс'], [49667, 'Рэй Янничелли']]",6.692,5.7,5.8,35000000$,Победитель,Биографический,Драма,Спортивные легенды,Новинки (2020–2025),6.692,5.7,5.1,DB & CSV
1041617,Все деньги мира,,2017,18,132,https://image.openmoviedb.com/kinopoisk-images/1946459/dfa67c0e-f343-4e5f-b0bb-317693f8487e/600x900,"История одного из самых громких скандалов XX века. В Риме преступники в масках похищают внука Жана Пола Гетти — богатейшего человека мира, известного своей маниакальной скупостью. Ко всеобщему шоку Гетти отказывается платить выкуп, несмотря на все мольбы Гэйл, матери ребенка, которой никакие богатства не заменят сына. Время истекает, требования похитителей становятся жёстче, и единственной надеждой на спасение подростка становится Флетчер Чейс — сотрудник службы безопасности самого Гетти.","['биография', 'триллер', 'криминал', 'детектив', 'драма']","['США', 'Италия', 'Великобритания', 'Китай']","[10015, 'Ридли Скотт']","[[1433, 'Мишель Уильямс'], [14847, 'Кристофер Пламмер'], [21038, 'Марк Уолберг'], [30601, 'Ромен Дюрис'], [10214, 'Тимоти Хаттон'], [2281301, 'Чарли Пламмер'], [3604317, 'Чарли Шотуэлл'], [1121084, 'Эндрю Бакан'], [30968, 'Марко Леонарди'], [4737597, 'Джузеппе Бонифати']]",6.936,6.8,6.9,50000000$,Все деньги мира,Биографический,Криминал,Исторические личности,Современное кино (2000–2020),6.936,6.8,7,DB & CSV
6770,Ватель,,2000,18,103,https://image.openmoviedb.com/kinopoisk-images/6201401/75936b65-f1f2-4e29-be73-c7e4b6ccd673/600x900,"Франция. 1671 год. Его Величество «король Солнце» Луи XIV в сопровождении королевы и многочисленной свиты изъявляет желание навестить замок принца Де Кондэ и провести там три дня. Небывалая честь одновременно и радует и пугает принца, ведь обедневшее поместье вряд ли сможет оказать достойный первой особы прием. Единственная надежда хозяина — его верный дворецкий — устроитель праздников и выдумщик Франсуа Ватель. Возглавив армию слуг, он готовит феерическое действо, приправленное изысканным меню и небывалыми увеселениями. Роскошный прием удался на славу, восторгу знатных гостей нет предела, а первая особа в государстве снова благоволит опальному принцу. Но на фоне большого праздника не утихают политические, дворцовые и любовные интриги, в паутину которых оказывается втянутым и Ватель...","['драма', 'мелодрама', 'биография', 'история']","['Франция', 'Великобритания', 'Бельгия']","[22087, 'Роланд Жоффе']","[[3954, 'Жерар Депардье'], [29595, 'Ума Турман'], [2145, 'Тим Рот'], [40825, 'Джулиан Гловер'], [11660, 'Джулиан Сэндс'], [13416, 'Тимоти Сполл'], [22405, 'Мюррэй Лачлан Янг'], [56633, 'Хайвел Беннетт'], [21466, 'Ричард Гриффитс'], [56634, 'Ариель Домбаль']]",7.231,6.6,6.1,36000000$,Ватель,Биографический,Исторический,Исторические личности,Современное кино (2000–2020),7.231,6.6,4.6,DB & CSV
680851,Война токов,The Current War: Director's Cut,2017,12,108,https://image.openmoviedb.com/kinopoisk-images/1946459/994f568a-dc50-4e2d-8bba-1747e59fefe2/600x900,"Америка, 1880 год. Мир освещается огнём, механизмы приводятся в движение паром или приложением силы. Гениальный изобретатель Томас Эдисон совершил ряд прорывных открытий, среди которых постоянный ток и изобретение лампы накаливания. Пока он встречается с инвесторами, инженер Джордж Вестингауз, сколотивший состояние на патенте тормозов для поездов, видит больше преимуществ в использовании переменного тока. Кроме того, недальновидный бизнесмен Эдисон берёт на работу простым инженером эмигранта Николу Теслу, и не увидев в его идеях потенциала, вскоре теряет ценного сотрудника. Соревнование за электрификацию американских городов — война постоянного и переменного токов продолжается.","['биография', 'история', 'драма']","['США', 'Россия', 'Великобритания']","[6523, 'Альфонсо Гомес-Рехон']","[[34549, 'Бенедикт Камбербэтч'], [2280681, 'Том Холланд'], [3506, 'Майкл Шеннон'], [42009, 'Николас Холт'], [1109750, 'Кэтрин Уотерстон'], [15521, 'Мэттью Макфэдиен'], [2778277, 'Оливер Пауэлл'], [4617929, 'Софиа Элли'], [1646825, 'Таппенс Мидлтон'], [3873224, 'Вуди Норман']]",6.655,6.5,6.5,,Война токов,Биографический,Исторический,Ученые и изобретатели,Современное кино (2000–2020),6.655,6.5,6.3,DB & CSV
220326,Иоанна – женщина на папском престоле,,2009,18,149,https://image.openmoviedb.com/kinopoisk-images/4303601/d7134a97-19f4-40bc-9761-9634172927eb/600x900,"В тайных хранилищах Ватикана сокрыта история запрещенной страсти и интриги, державшаяся в секрете Католической церковью более тысячи лет. Хотя официально Ватикан до сих пор не признал того факта, что два года на святом престоле пребывала женщина, легенды об этом  бытуют до сих пор. Год 814 от Рождества Христова. 28 января умирает Карл Великий, в тот же день рождается Иоанна - страстная натура, умевшая любить, рисковать и побеждать...","['драма', 'мелодрама', 'история']","['Германия', 'Великобритания', 'Италия', 'Испания']","[83122, 'Зёнке Вортманн']","[[385891, 'Йоханна Вокалек'], [1492, 'Дэвид Уэнэм'], [7317, 'Джон Гудман'], [50311, 'Иэн Глен'], [96349, 'Эдвард Петербридж'], [23243, 'Анатоль Таубман'], [1309873, 'Лотте Флак'], [831292, 'Йёрдис Трибель'], [29860, 'Оливер Коттон'], [58117, 'Николас Вудесон']]",7.592,6.7,7.1,22000000€,Иоанна — женщина на папском престоле,Биографический,Исторический,Исторические личности,Современное кино (2000–2020),7.592,6.7,0,DB & CSV
807758,Класс 92,,2013,,99,https://image.openmoviedb.com/kinopoisk-images/1629390/51497370-dee3-4e9f-9a13-cea6f3ad97f1/600x900,"Эта история расскажет о пути к мировой славе шести молодых футболистов из «Манчестер Юнайтед»: Дэвида Бекхэма, Райана Гиггза, Пола Скоулза, Ники Батта, Фила и Гари Невилл. Фильм охватывает семилетний период их карьеры, начиная с 1992 года, когда команда впервые за 30 лет выиграла Молодежный Кубок Англии и заканчивая 1999-м, когда Лига чемпионов УЕФА стала настоящим триумфом для «Манчестер Юнайтед».","['документальный', 'спорт']",['Великобритания'],"[1463757, 'Бенжамин Тернер']","[[37321, 'Дэвид Бекхэм'], [1290176, 'Никки Батт'], [37322, 'Райан Гиггз'], [37326, 'Гари Невилл'], [1290181, 'Фил Невилл'], [37328, 'Пол Скоулс'], [41816, 'Дэнни Бойл'], [68208, 'Эрик Кантона'], [3428519, 'Эрик Харрисон'], [41969, 'Мани']]",8.025,7.9,8.0,1250000$,Класс 92,Биографический,Семейный,Спортивные легенды,Современное кино (2000–2020),8.025,7.9,0,DB & CSV
470314,Майкл Джексон: Вот и всё,Michael Jackson's This Is It: The IMAX Experience,2009,12,111,https://image.openmoviedb.com/kinopoisk-images/4774061/32ff9354-1751-443f-bd99-700ce4ea324e/600x900,"Он изменил мир: современная музыка и в целом поп-культура сформировались под огромным влиянием его творчества. Мир изменил его: став божеством сцены, он лишился свободы быть простым человеком. Майкл Джексон - символ ХХ века, одухотворенного и жестокого. В XXI веке артист готовился к грандиозному туру, который изменил бы представления о концертах мегазвездного уровня.    Документальный фильм-концерт «Майкл Джексон: Вот и все» рассказывает о том, что никогда больше не случится с нами. Это не только шоу с исполнением гениальных хитов, но и моменты творческого процесса: поиск правильного звучания, постановка хореографии, разработка видеосопровождения.    И над каждым моментом профессионально и дотошно работал сам Майкл, чтобы донести до зрителя свой талант в идеальной форме. Уникальное шоу «Вот и все» должно было стать прощальным в карьере Майкла, но не состоялось. Остались только рабочие видеозаписи - последний прижизненный архив великого артиста.  И фильм «Майкл Джексон: Вот и все» стал прощанием с Майклом и его эпохой.","['документальный', 'музыка']",['США'],"[113358, 'Кенни Ортега']","[[39233, 'Майкл Джексон'], [1873910, 'Алекс Аль'], [1105767, 'Александра Апжарова'], [1931051, 'Ник Басс'], [452391, 'Майкл Берден'], [1942254, 'Ирина Бречер'], [1050370, 'Дэниэл Целебре'], [1231522, 'Мекиа Кокс'], [1959561, 'Майлз Фабер'], [1873913, 'Крис Грант']]",7.74,7.2,7.3,60000000$,Майкл Джексон: Вот и все,Биографический,Драма,Творческие гении,Современное кино (2000–2020),7.74,7.2,7.1,DB & CSV
5560,Елизавета,Elizabeth: The Virgin Queen,1998,18,124,https://image.openmoviedb.com/kinopoisk-images/1600647/d5b49d5c-117f-4833-ac6f-2aca16824903/600x900,"Англия, 1554 год. Старшая дочь Генриха VIII, королева Мария, ревностная католичка, умирает, и королевой становится юная Елизавета, дочь Генриха и Анны Болейн. Ей приходится расстаться с радостями свободы ради могущества и единства Англии, независимости которой угрожают Испания, Франция и Папа Римский. Елизавета решается на самые отчаянные и неожиданные меры, благодаря которым она и осталась в истории Англии самой великой королевой и самой талантливой женщиной.","['драма', 'биография', 'история']","['Великобритания', 'США']","[36147, 'Шекхар Капур']","[[112, 'Кейт Бланшетт'], [24683, 'Джеффри Раш'], [15980, 'Джозеф Файнс'], [16548, 'Ричард Аттенборо'], [20148, 'Кристофер Экклстон'], [4060, 'Кэти Бёрк'], [42003, 'Фанни Ардан'], [11506, 'Венсан Кассель'], [68208, 'Эрик Кантона'], [7038, 'Эмили Мортимер']]",7.659,7.4,7.5,30000000$,Елизавета,Биографический,Драма,Исторические личности,Классика (до 2000 года),7.659,7.4,7.4,DB & CSV
5105855,Одна жизнь,,2023,18,109,https://image.openmoviedb.com/kinopoisk-images/9784475/4564801f-fe39-4493-b042-98038357d242/600x900,"Скромного и непубличного джентльмена Николаса Уинтона приглашают на телевизионное ток-шоу, где он наконец-то узнает всю правду о событиях Второй мировой войны, когда он пытался спасти сотни детей от гибели в концлагере. Одна жизнь может изменить судьбы сотен людей — как в прошлом, так и в настоящем.","['драма', 'биография', 'история']","['Великобритания', 'Чехия', 'Австралия', 'США']","[589193, 'Джеймс Хоуз']","[[8968, 'Энтони Хопкинс'], [25775, 'Хелена Бонем Картер'], [739199, 'Джонни Флинн'], [6236, 'Лена Олин'], [966872, 'Тим Стид'], [3821, 'Матильда Торпе'], [2410232, 'Дэниэл Браун'], [3112178, 'Алекс Шарп'], [1454888, 'Иржи Симек'], [29744, 'Ромола Гарай']]",8.532,7.5,7.8,,Одна жизнь,Биографический,Исторический,Исторические личности,Новинки (2020–2025),8.532,7.5,7.3,DB & CSV
