ID,Title_RU,Title_EN,Year,Age_Rating,Runtime,Image_URL,Synopsis,DB_Genres,Countries,Director,Cast,DB_Rating_1,DB_Rating_2,DB_Rating_3,Budget,CSV_Title_RU,CSV_Category_1,CSV_Category_2,CSV_Category_3,CSV_Category_4,CSV_Rating_1,CSV_Rating_2,CSV_Rating_3,Source
692451,Игра на высоте,,2014,12,115,https://image.openmoviedb.com/kinopoisk-images/1773646/26bf566d-4948-4a9c-9861-ddec12d40dc3/600x900,"Фильм основан на реальных событиях. Это история футбольного тренера, благодаря которому безызвестная школьная футбольная команда провела победную серию из 151 игры.","['драма', 'семейный', 'биография', 'спорт']",['США'],"[48070, 'Томас Картер']","[[11383, 'Джеймс Кэвизел'], [27276, 'Майкл Чиклис'], [666062, 'Александр Людвиг'], [20802, 'Клэнси Браун'], [22693, 'Лора Дерн'], [2546862, 'Мэттью Даддарио'], [2349987, 'Джо Массинджилл'], [1221949, 'Джесси Ашер'], [1967291, 'Сер’Дариус Блэйн'], [2541210, 'Стефан Джеймс']]",6.821,6.6,6.0,15000000$,Игра на высоте,Биографический,Драма,Творческие гении,Современное кино (2000–2020),6.821,6.6,4.6,DB & CSV
872,Видок,Dark Portals: The Chronicles of Vidocq,2001,18,98,https://image.openmoviedb.com/kinopoisk-images/1600647/80082ab9-40cb-461d-a80a-b4a9651c3868/600x900,"В Париже завёлся серийный убийца, которого может вычислить только гениальный сыщик Видок. Это реальный исторический персонаж, не знающий удержу ни в своих перевоплощениях, ни в дьявольской интуиции. Он мчится по следу загадочного Алхимика – существа неизвестного пола, постоянно скрывающего лицо за маской-зеркалом.","['фантастика', 'фэнтези', 'боевик', 'триллер', 'криминал', 'детектив']",['Франция'],"[51684, 'Питоф']","[[3954, 'Жерар Депардье'], [51685, 'Гийом Кане'], [3349, 'Инес Састре'], [454, 'Андре Дюссолье'], [29481, 'Эдит Скоб'], [51686, 'Мусса Мааскри'], [24534, 'Жан-Пьер Гос'], [51687, 'Изабель Рено'], [34765, 'Жан-Поль Дюбуа'], [51688, 'Андре Пенверн']]",7.168,6.4,6.7,152000000FRF,Видок,Биографический,Детектив,Исторические личности,Современное кино (2000–2020),7.168,6.4,6.6,DB & CSV
4885,Во имя отца,,1993,16,133,https://image.openmoviedb.com/kinopoisk-images/1773646/48b2ede8-9d97-4bbb-b4ef-115b7f899228/600x900,"Эта драма основана на реальных событиях - истории `Гилфордской четверки`. В 1975 году молодой ирландец Джерри Конлон был приговорен английским правосудием к пожизненному заключению за покушение, которое он не совершал. Трое его друзей, его отец, тетя, племянница и племянник также осуждены за соучастие. Адвокат Гэрит Перси пытается добиться пересмотра дела.","['драма', 'криминал', 'биография']","['Ирландия', 'США', 'Великобритания']","[16216, 'Джим Шеридан']","[[41494, 'Дэниэл Дэй-Льюис'], [8634, 'Пит Постлетуэйт'], [15526, 'Эмма Томпсон'], [17171, 'Джон Линч'], [227551, 'Марк Шеппард'], [16397, 'Бети Эдни'], [15005, 'Фрэнк Харпер'], [37235, 'Бритта Смит'], [17771, 'Корин Редгрейв'], [17390, 'Джерард МакСорли']]",7.792,8.1,7.9,13000000$,Во имя отца,Биографический,Драма,Исторические личности,Классика (до 2000 года),7.792,8.1,7.8,DB & CSV
1077074,Идеальный дворец Фердинанда Шеваля,,2017,18,105,https://image.openmoviedb.com/kinopoisk-images/6201401/9c0f3f7f-de06-49cd-9150-276c36bd5156/600x900,"Каждый день почтальон Фердинанд Шеваль проделывал путь в 25-30 километров, доставляя почту в окрестные деревни. Однажды он споткнулся и упал, и его внимание привлек камень причудливой формы. Шеваль забирает «камень преткновения», и ему приходит в голову идея строительства сказочного дворца для своей маленькой дочки.  В течение последующих 33 лет он в свободное от работы время на купленном в Отриве небольшом клочке земли возводит удивительное строение, которое называет «идеальным дворцом».","['драма', 'биография']","['Франция', 'Бельгия']","[106109, 'Нильс Тавернье']","[[44140, 'Жак Гамблен'], [58873, 'Летиция Каста'], [75552, 'Флоранс Томассен'], [88589, 'Бернар Ле Кок'], [81702, 'Наташа Линдинжер'], [4595515, 'Зели Риксон'], [13871, 'Эрик Савен'], [4375935, 'Лука Пети Таборелли'], [233300, 'Орельен Вик'], [3489345, 'Жюльен Персонас']]",8.005,7.1,7.6,,Идеальный дворец Фердинанда Шеваля,Биографический,Исторический,Творческие гении,Современное кино (2000–2020),8.005,7.1,0,DB & CSV
935508,Любовь и страсть. Далида,,2016,18,127,https://image.openmoviedb.com/kinopoisk-images/1629390/b9cc4eb3-dcb6-426e-8548-1270c7d6dc42/600x900,"Она была рождена, чтобы стать звездой. Она обладала магической красотой и невероятным голосом. Она ворвалась на музыкальный Олимп и завладела сердцами всего мира. Но слава и деньги не принесли ей счастья. Всю жизнь она искала настоящую любовь и ради нее пожертвовала всем.","['драма', 'биография', 'музыка']",['Франция'],"[240049, 'Лиза Азуэлос']","[[2697895, 'Свева Альвити'], [14184, 'Венсан Перес'], [483532, 'Риккардо Скамарчо'], [1549033, 'Нильс Шнайдер'], [41578, 'Жан-Поль Рув'], [1818134, 'Алессандро Борги'], [2842, 'Николя Дювошель'], [4282432, 'Валентина Карли'], [240092, 'Патрик Тимси'], [2402, 'Лоран Бато']]",7.163,6.9,7.0,15000000€,Любовь и страсть. Далида,Биографический,Мелодрама,Творческие гении,Современное кино (2000–2020),7.163,6.9,0,DB & CSV
5116673,Петр I: Последний царь и первый император,,2022,12,112,https://image.openmoviedb.com/kinopoisk-images/10703959/b894ae57-fc9b-4d8b-a0e1-33e5ecc5d6bd/600x900,"Фигура императора Петра Великого, как и эпоха его становления и правления, до сих пор будоражит умы людей во всем мире. Создатели отвечают на вопросы, как занять престол, когда ты — четырнадцатый ребенок в семье; как отвоевать выход к морю, когда в стране нет профессиональной армии и флота; как за несколько десятилетий вывести в мировые лидеры страну, с которой раньше никто не считался, и многие другие.","['история', 'биография']",['Россия'],"[690065, 'Андрей Кравчук']","[[1203446, 'Иван Колесников'], [3488237, 'Алексей Лукин'], [3736912, 'Даниил Муравьев-Изотов'], [2213025, 'Вольфганг Черни'], [4561069, 'Максим Иванов'], [5873678, 'Ксения Утехина'], [5724988, 'Анастасия Мишина'], [2454210, 'Юлия Бочарова'], [6866856, 'Роман Коноплев'], [544304, 'Александр Большаков']]",7.158,0.0,7.2,,Петр I: Последний царь и первый император,Биографический,Исторический,Исторические личности,Современное кино (2000–2020),7.158,0,0,DB & CSV
505783,Джеки,,2016,18,100,https://image.openmoviedb.com/kinopoisk-images/1599028/0623ae31-fe4b-4feb-b0d2-d66f151e014f/600x900,"О Жаклин Кеннеди — первой леди Соединенных Штатов в начале 60-х, самой популярной женщине своего времени, иконе стиля — написаны десятки книг и снято немало фильмов, но огромный интерес к ее жизни с годами не угасает. В этой ленте авторы воспроизвели один из трагических моментов в американской истории — убийство президента Кеннеди в Далласе — и последовавшие за ним несколько дней, показав этих события глазами самой Жаклин. Весь мир восхищался ее стойкостью, достоинством и самообладанием. Но что на самом деле пережила эта женщина?..","['драма', 'биография']","['США', 'Франция', 'Чили', 'Китай']","[819927, 'Пабло Ларраин']","[[24285, 'Натали Портман'], [32953, 'Питер Сарсгаард'], [971257, 'Грета Гервиг'], [2668, 'Билли Крудап'], [9331, 'Джон Хёрт'], [15446, 'Ричард Э. Грант'], [968795, 'Каспар Филлипсон'], [20908, 'Джон Кэрролл Линч'], [32453, 'Бет Грант'], [9897, 'Макс Казелла']]",6.23,6.6,6.9,9000000$,Джеки,Биографический,Драма,Исторические личности,Современное кино (2000–2020),6.23,6.6,7.9,DB & CSV
885316,Время первых,Spacewalk,2017,6,140,https://image.openmoviedb.com/kinopoisk-images/1600647/ec196576-3ef0-4200-9f51-4b53b2813759/600x900,"Разгар холодной войны, 1960 год. Две супердержавы, СССР и США бьются за первенство в космической гонке. Пока СССР впереди, на очереди — выход человека в открытый космос. За две недели до старта взрывается тестовый корабль. Времени на выявление причин нет. И пусть риски огромны, мы не можем уступить лидерство. Опытный военный лётчик Павел Беляев и его напарник Алексей Леонов, необстрелянный и горячий, мечтающий о подвиге, — два человека, готовые шагнуть в неизвестность. Но никто не мог даже предположить всего, с чем им предстояло столкнуться в полёте. В этой миссии всё, что только можно, пошло не так...","['приключения', 'триллер', 'биография', 'история']",['Россия'],"[2000605, 'Дмитрий Киселёв']","[[40159, 'Евгений Миронов'], [231512, 'Константин Хабенский'], [101753, 'Владимир Ильин'], [266135, 'Анатолий Котенёв'], [1055925, 'Александра Урсуляк'], [251224, 'Елена Панова'], [965290, 'Александр Новин'], [4138819, 'Марта Кесслер'], [1175949, 'Геннадий Смирнов'], [313563, 'Юрий Нифонтов']]",7.478,7.2,7.3,400000000₽,Время первых,Биографический,Исторический,Ученые и изобретатели,Современное кино (2000–2020),7.478,7.2,0,DB & CSV
1043228,Rammstein: Paris!,,2017,12,98,https://image.openmoviedb.com/kinopoisk-images/1898899/c4883a72-a74b-4f25-a220-ceb0d75c9533/600x900,,"['концерт', 'музыка', 'документальный']",['Великобритания'],"[40830, 'Йонас Окерлунд']","[[36726, 'Рихард Круспе'], [36728, 'Пауль Ландерс'], [36729, 'Тилль Линдеманн'], [36730, 'Кристиан Лоренц'], [36731, 'Оливер Ридель'], [36732, 'Кристоф Шнайдер'], [831735, 'Беттина Луз'], [4327888, 'Софи Онильон'], [40830, 'Йонас Окерлунд'], [614408, 'Эрик Бромс']]",8.582,8.2,8.4,,Rammstein: Paris!,Биографический,Боевик (Экшен),Творческие гении,Современное кино (2000–2020),8.582,8.2,0,DB & CSV
569071,Жена смотрителя зоопарка,,2017,18,127,https://image.openmoviedb.com/kinopoisk-images/1600647/63771e4c-3614-449c-a420-bcaf3288130a/600x900,"1939 год, Польша. Варшавским зоопарком управляет доктор Ян Жабинский и его жена Антонина. Их спокойная жизнь заканчивается 1 сентября, когда нацистская Германия начинает оккупацию Польши. С этого дня страшные новости следуют одна за другой: животные погибают, зоопарк должен быть ликвидирован, а польские евреи — отправлены в гетто. Среди изгоняемых оказывается подруга семьи, и жена предлагает спрятать её. Опасная идея, кажущаяся безумной, становится началом развёрнутой подпольной деятельности, в которой Антонина и Ян, рискуя собственными жизнями, будут спасать других людей.","['драма', 'военный', 'биография', 'история']","['США', 'Великобритания', 'Чехия']","[40950, 'Ники Каро']","[[1111242, 'Джессика Честейн'], [100636, 'Йохан Хелденберг'], [242467, 'Даниэль Брюль'], [4218909, 'Тимоти Редфорд'], [1939730, 'Эфрат Дор'], [39860, 'Иддо Голдберг'], [3502280, 'Шира Хаас'], [213, 'Майкл МакЭлхаттон'], [4190767, 'Вэл Малоку'], [232407, 'Марта Иссова']]",7.407,7.0,6.9,20000000$,Жена смотрителя зоопарка,Биографический,Исторический,Исторические личности,Современное кино (2000–2020),7.407,7,6.2,DB & CSV
4765870,Честная игра,,2021,18,,https://image.openmoviedb.com/kinopoisk-images/4774061/44d2600d-58ef-449d-a741-76529dd6bba6/600x900,"Стефа Полозова разрывается между долгом и счастьем. Она давно замужем, но это необычный брак — в нем никогда не было любви: их с Ярославом свели особые обстоятельства — много лет все свои нежные чувства Стефа отдавала двойняшкам Нине и Артему, но встреча с Игорем перевернула ее жизнь. А внезапная гибель матери становится для героини началом сложного пути к себе и переосмыслению прошлого, настоящего и будущего.",['мелодрама'],['Украина'],"[2374591, 'Андрей Иванов']","[[1896084, 'Елена Радевич'], [1449444, 'Артем Алексеев'], [1605264, 'Михаил Химичев'], [1931244, 'Дарья Трегубова'], [74707, 'Елена Стефанская'], [1744162, 'Константин Косинский'], [4768579, 'Полина Носыхина'], [5139565, 'Данил Шевченко'], [4756734, 'Юрий Кухаренко'], [5894625, 'Анна Иванова']]",6.963,0.0,7.0,,Честная игра,Биографический,Драма,Исторические личности,Современное кино (2000–2020),6.963,0,0,DB & CSV
355,Пианист,The Pianist,2002,18,149,https://image.openmoviedb.com/kinopoisk-images/1946459/6d71694e-3796-4e1c-96aa-0e982c2bc03d/600x900,"Фильм снят по автобиографии Владислава Шпильмана, одного из лучших пианистов Польши 30-х годов прошлого века. Главный герой фильма — Владек — занимается искусством до тех пор, пока территорию Польши не занимают нацисты. Жизнь всех евреев меняется: их помещают в Варшавское гетто, запрещают работать, унижают, заставляют носить отличительные повязки, а через некоторое время отправляют в концлагерь.","['драма', 'военный', 'биография', 'музыка']","['Франция', 'Польша', 'Великобритания', 'Германия']","[16563, 'Роман Полански']","[[2523, 'Эдриан Броуди'], [38080, 'Эмилия Фокс'], [12128, 'Даниэль Кальтаджироне'], [15451, 'Эд Стоппард'], [38079, 'Морин Липман'], [4064, 'Фрэнк Финлей'], [38082, 'Джессика Кейт Мейер'], [38081, 'Джулия Рейнер'], [38078, 'Томас Кречман'], [38083, 'Михал Жебровский']]",8.474,8.5,8.4,35000000$,Пианист,Биографический,Военный,Творческие гении,Современное кино (2000–2020),8.474,8.5,8.2,DB & CSV
282491,Подтверждение,,2007,,16,https://image.openmoviedb.com/kinopoisk-images/1704946/7fc76c3e-8bfa-4dfc-acea-7fe26dcebefc/600x900,"Фильм об удивительной бесплатной парковке, бесплатных комплиментах и невероятной истории любви.","['короткометражка', 'мелодрама', 'комедия']",['США'],"[373682, 'Курт Куэнне']","[[1941, 'Ти-Джей Тайн'], [55068, 'Вики Дэвис'], [965562, 'Дэйв Кур'], [373435, 'Пэм Кук'], [2507985, 'Рон Оден'], [229986, 'Маноло Травиесо'], [1119675, 'Майкл Джордан Хэтч'], [1236785, 'Ричард Бинан'], [1236801, 'Джеки Уолтерс'], [255457, 'Ральф Дайнер']]",8.334,8.1,8.2,,Подтверждение,Биографический,Драма,Исторические личности,Современное кино (2000–2020),8.334,8.1,0,DB & CSV
22597,Мандерлей,The Film 'Manderlay' as Told in Eight Straight Chapters,2005,18,133,https://image.openmoviedb.com/kinopoisk-images/1946459/f279b5c0-8ca8-43d1-98d5-65d4741c7692/600x900,"Через два месяца после описанных в «Догвилле» событий Грейс оказывается на плантации в Алабаме, где рабочие не знают, что рабство было отменено 70 лет назад...",['драма'],"['Дания', 'Швеция', 'Нидерланды', 'Франция', 'Германия', 'Великобритания', 'Италия', 'США']","[31951, 'Ларс фон Триер']","[[8965, 'Брайс Даллас Ховард'], [2320, 'Исаак Де Банколе'], [2317, 'Дэнни Гловер'], [9274, 'Уиллем Дефо'], [410287, 'Микаэль Абитбуль'], [31952, 'Лорен Бэколл'], [30609, 'Жан-Марк Барр'], [56644, 'Джефри Бейтмен'], [540113, 'Вёрджил Брэмли'], [555085, 'Рубен Бринкман']]",7.146,7.2,6.7,14200000$,Мандерлей,Биографический,Драма,Исторические личности,Современное кино (2000–2020),7.146,7.2,5.7,DB & CSV
1263429,Глаза Тэмми Фэй,,2021,,126,https://image.openmoviedb.com/kinopoisk-images/1629390/c30d5568-9caa-4a30-b919-3d14dceafba8/600x900,"Стремительный взлёт, падение и раскаяние телеевангелистов Тэмми Фэй Беккер и Джима Беккера, которые с 1976 по 1987 год вместе вели христианскую телепередачу. Они выстроили вокруг себя мощную империю по зарабатыванию денег, потерпевшую в итоге крах после череды секс-скандалов, финансовых махинаций и действий соперников.","['драма', 'мелодрама', 'биография']",['США'],"[39971, 'Майкл Шоуолтер']","[[1111242, 'Джессика Честейн'], [1156574, 'Эндрю Гарфилд'], [23723, 'Черри Джонс'], [8771, 'Винсент Д’Онофрио'], [702636, 'Марк Выстрач'], [39501, 'Сэм Джагер'], [400753, 'Луис Канселми'], [12172, 'Гэбриел Олдз'], [14233, 'Фредрик Лене'], [3714688, 'Чандлер Хэд']]",6.524,6.6,6.5,,Глаза Тэмми Фэй,Биографический,Драма,Другое,Новинки (2020–2025),6.524,6.6,6.5,DB & CSV
197134,Жизнь в розовом цвете,The Passionate Life of Edith Piaf,2007,18,140,https://image.openmoviedb.com/kinopoisk-images/1946459/307e0ceb-aef6-4f26-b724-c80fb13879f2/600x900,"Жизнь Эдит Пиаф была похожа на сражение, каждый день ей приходилось бороться за право жить, петь и любить! Из трущоб Парижа она поднялась на подмостки Нью-Йоркских концертных залов и завладела сердцами всего мира. Ее друзьями были известнейшие люди того времени - Жан Кокто, Марлен Дитрих, Марсель Сердан. Выросшая в жуткой нищете, Пиаф достигла колоссального успеха. Но, взлетев на необозримую высоту, она не смогла не обломать крылья...","['драма', 'мелодрама', 'биография', 'музыка']","['Франция', 'Великобритания', 'Чехия']","[223537, 'Оливье Даан']","[[32545, 'Марион Котийяр'], [52729, 'Сильви Тестю'], [20018, 'Паскаль Греггори'], [24735, 'Эмманюэль Сенье'], [41578, 'Жан-Поль Рув'], [3954, 'Жерар Депардье'], [28425, 'Клотильда Куро'], [466687, 'Жан-Пьер Мартен'], [130937, 'Катрин Аллегре'], [1960171, 'Марк Барбе']]",7.892,7.5,7.4,25000000$,Жизнь в розовом цвете,Биографический,Драма,Творческие гении,Современное кино (2000–2020),7.892,7.5,6.9,DB & CSV
