ID;Title_RU;Title_EN;Year;Age_Rating;Runtime;Image_URL;Synopsis;DB_Genres;Countries;Director;Cast;DB_Rating_1;DB_Rating_2;DB_Rating_3;Budget;CSV_Title_RU;CSV_Category_1;CSV_Category_2;CSV_Category_3;CSV_Category_4;CSV_Rating_1;CSV_Rating_2;CSV_Rating_3;Source
893150;Война и мир;;2016;18;;https://image.openmoviedb.com/kinopoisk-images/1900788/ecbb3822-ee34-42f6-8480-e0920b41a050/600x900;"Действие сериала развивается в России XIX века, охватывая период с 1805 по 1812 годы. В основу сюжета положен роман Льва Толстого «Война и мир», основное внимание сфокусировано на судьбах Пьера Безухова, Андрея Болконского и Наташи Ростовой.";"['драма', 'мелодрама', 'военный', 'история']";['Великобритания'];"[1156636, 'Том Харпер']";"[[43219, 'Пол Дано'], [1832932, 'Джеймс Нортон'], [2331904, 'Лили Джеймс'], [59980, 'Эдриен Эдмондсон'], [1210361, 'Эшлин Лофтус'], [3007, 'Грета Скакки'], [2341341, 'Джек Лауден'], [1646825, 'Таппенс Мидлтон'], [1772158, 'Анайрин Барнард'], [4300676, 'Джесси Бакли']]";8.019;8.1;8.1;;Война и мир;Исторический;Военный;Военные события;Классика (до 2000 года);8.019;8.1;0;DB & CSV
972740;Союз Спасения;;2019;12;134;https://image.openmoviedb.com/kinopoisk-images/1704946/4c0cc9c9-8d08-4162-95d8-0658c5bda408/600x900;"Императорские войска России заняли Париж. Россия стала первой державой мира. Теперь всё кажется возможным. Молодые победители, гвардейские офицеры, уверены, что равенство и свобода наступят - здесь и сейчас. Ради этого они готовы принести в жертву всё — положение, богатство, любовь, жизнь… и саму страну.";"['история', 'биография', 'драма']";['Россия'];"[690065, 'Андрей Кравчук']";"[[1205146, 'Леонид Бичевин'], [1358151, 'Максим Матвеев'], [1681168, 'Павел Прилучный'], [238525, 'Иван Янковский'], [1358155, 'Антон Шагин'], [248308, 'Александр Домогаров'], [231397, 'Игорь Петренко'], [1055858, 'Сергей Перегудов'], [1562411, 'Виталий Кищенко'], [1203446, 'Иван Колесников']]";5.933;5.2;5.6;980000000₽;Союз спасения;Исторический;Военный;Военные события;Современное кино (2000–2020);5.933;5.2;0;DB & CSV
841978;Баджирао и Мастани;;2015;;158;https://image.openmoviedb.com/kinopoisk-images/1946459/1f2e59d1-4e4b-4ed5-9e15-eef0a41bd062/600x900;История любви индуистского военачальника Баджирао I и мусульманской принцессы Мастани.;"['мелодрама', 'история', 'военный', 'боевик']";['Индия'];"[43788, 'Санджай Лила Бхансали']";"[[1976709, 'Ранвир Сингх'], [1087164, 'Дипика Падукон'], [229163, 'Приянка Чопра Джонас'], [41883, 'Танви Азми'], [236041, 'Махеш Манджрекар'], [255167, 'Раза Мурад'], [260152, 'Адитья Панчоли'], [233774, 'Милинд Соман'], [3873111, 'Вайбхав Татвавади'], [238259, 'Ятин Карьекар']]";7.55;7.3;7.0;1250000000₹;Баджирао и Мастани;Исторический;Мелодрама;Эпические саги;Современное кино (2000–2020);7.55;7.3;6.1;DB & CSV
195751;Проклятие золотого цветка;Curse of the Golden Flower;2006;18;114;https://image.openmoviedb.com/kinopoisk-images/1898899/eaea746b-71aa-428a-8ebd-8b2f660548e7/600x900;"Китай, X век. Император возвращается из долгого похода. Он поражен холодной встречей придворных. Императрица тщательно скрывает тайную связь с кронпринцем, странно ведет себя и его сын. Двор погряз в любовных и политических интригах, оплетающих дворец, словно гирлянды золотых хризантем. Император чувствует, что его хотят свергнуть.  Во время пышной церемонии традиционного осеннего фестиваля дворец заполняют воины. На площади - тысячи раздавленных золотых цветов, обагренных предательской кровью.";"['драма', 'боевик', 'мелодрама', 'история']";"['Гонконг', 'Китай', 'Великобритания', 'США']";"[58856, 'Чжан Имоу']";"[[10919, 'Чоу Юнь-Фат'], [82153, 'Гун Ли'], [957100, 'Джей Чоу'], [226485, 'Лю Е'], [432730, 'Ни Дахун'], [1107249, 'Цинь Цзюньцзе'], [1107250, 'Ли Мань'], [1020197, 'Чэнь Цзинь'], [4219808, 'Аарон С. Шан'], [2354336, 'Гэ Сыжань']]";7.117;7.0;6.8;45000000$;Проклятие золотого цветка;Исторический;Боевик (Экшен);Эпические саги;Современное кино (2000–2020);7.117;7;6.4;DB & CSV
45674;Василий Буслаев;;1982;6;81;https://image.openmoviedb.com/kinopoisk-images/1704946/f93261eb-e043-4c0d-a8c0-66c8944c8aa0/600x900;"Фильм-сказка о былинном русском богатыре Василии Буслаеве – сыне Новгородского посадника. Жил он как хотел, сам по себе: не верил ни в сон, ни в чех, ни в змеиный шип, ни в вороний грай. Сила и мощь Василия, сына Новгородского посадника (губернатора), водившего дружбу с простым народом, приводила в бешенство и нагоняла страх на разжиревших купцов новгородских. Дана была ему Богом сила Великая, а кому много дадено, с того много спросится.   Грянула беда: напал на святую Русь народ немилостивый, лютый, младости детей и немощи старцев не щадящий, и стал Василий – русский богатырь, щитом и мечом родимой земле, господину Великому Новгороду… Когда купцы узнали, что юноша собирается в поход во имя спасения своей земли от ворога, радости их не было границ.  Разве можно сломить ту силу великую! Но Василий кладет конец всяческим козням и доводит свою экспедицию до победного конца. Он возвращается домой героем и еще привозит с собой зазнобу.";"['фэнтези', 'драма', 'история']";['СССР'];"[199931, 'Геннадий Васильев']";"[[269781, 'Дмитрий Золотухин'], [284866, 'Людмила Хитяева'], [266187, 'Ирина Алферова'], [174241, 'Дмитрий Матвеев'], [273342, 'Алексей Зайцев'], [185573, 'Валерий Носик'], [109509, 'Наталья Крачковская'], [269563, 'Михаил Кокшенов'], [287592, 'Матлюба Алимова'], [217786, 'Николай Погодин']]";7.202;6.6;6.9;;Василий Буслаев;Исторический;Приключения;Эпические саги;Новинки (2020–2025);7.202;6.6;0;DB & CSV
462455;Дружинники;Neighborhood Watch;2012;18;102;https://image.openmoviedb.com/kinopoisk-images/4774061/af6a88e5-f12f-4ef8-b483-c5290a6fd62b/600x900;"Сюжет фильма разворачивается вокруг дружной компании соседей, организовавших дружину ради патрулирования окрестностей и поддержания порядка. В действительности благие намерения были лишь поводом хотя бы изредка сбегать от семьи, дабы покутить вечерком в сугубо мужской компании. Безоблачная жизнь заканчивается в тот момент, когда соседский дозор случайно узнаёт о заговоре с целью уничтожить мир.";"['фантастика', 'комедия']";['США'];"[1096251, 'Акива Шаффер']";"[[9208, 'Бен Стиллер'], [7886, 'Винс Вон'], [581340, 'Джона Хилл'], [916137, 'Ричард Айоади'], [572289, 'Розмари ДеУитт'], [565081, 'Уилл Форте'], [2277574, 'Эрин Мориарти'], [460529, 'Николас Браун'], [14108, 'Р. Ли Эрми'], [2668, 'Билли Крудап']]";5.904;5.7;5.2;68000000$;Дружинники;Исторический;Боевик (Экшен);Военные события;Новинки (2020–2025);5.904;5.7;4.1;DB & CSV
161104;Тарас Бульба;Taras Bulba;2009;18;131;https://image.openmoviedb.com/kinopoisk-images/1704946/b67d4f21-f4c0-49d7-9d9c-205598d1afd2/600x900;"Действие разворачивается в сложный период истории казачества, когда запорожцы боролись с Речью Посполитой. В пучине этих событий глубокую личную драму переживает казак Тарас Бульба: его младший сын, Андрий, полюбил прекрасную дочь польского воеводы и хочет бежать из Сечи. Раздираемый чувством и долгом Тарас объявляет сыну последнюю родительскую волю…";"['боевик', 'драма', 'военный', 'история']";['Россия'];"[256810, 'Владимир Бортко']";"[[25255, 'Богдан Ступка'], [231397, 'Игорь Петренко'], [432301, 'Владимир Вдовиченков'], [34768, 'Магдалена Мельцаж'], [269826, 'Любомирас Лауцявичюс'], [257042, 'Ада Роговцева'], [238512, 'Михаил Боярский'], [37387, 'Сергей Дрейден'], [75797, 'Юрий Беляев'], [281297, 'Лесь Сердюк']]";6.66;5.7;6.2;15700000$;Тарас Бульба;Исторический;Военный;Военные события;Современное кино (2000–2020);6.66;5.7;0;DB & CSV
1044981;Рождённый стать королём;;2019;6;120;https://image.openmoviedb.com/kinopoisk-images/1898899/aae6fd33-97a1-4bda-9740-fee65b3d74fe/600x900;"В руках Алекса, обыкновенного британского школьника, оказывается мифический меч Экскалибур. Теперь парню и его друзьям предстоит сразиться со средневековой злодейкой по имени Моргана, которая изо всех сил пытается уничтожить мир.";"['фэнтези', 'боевик', 'приключения', 'семейный']";"['Великобритания', 'США']";"[394395, 'Джо Корниш']";"[[4521458, 'Луис Эшборн Серкис'], [749016, 'Дениз Гоф'], [4757307, 'Дин Чауму'], [3833732, 'Том Тейлор'], [4757306, 'Рианна Доррис'], [1485845, 'Нэйтан Стюарт-Джарретт'], [40419, 'Нома Думезвени'], [498650, 'Ребекка Фергюсон'], [1076722, 'Марк Боннар'], [1532136, 'Энгус Имри']]";5.919;6.1;6.3;59000000$;Рожденный стать королем;Исторический;Драма;Эпические саги;Новинки (2020–2025);5.919;6.1;6.9;DB & CSV
46017;Баллада о доблестном рыцаре Айвенго;;1982;16;92;https://image.openmoviedb.com/kinopoisk-images/1599028/cc553265-37c9-4f8c-96b1-4fe1ab2d3cc9/600x900;"Баллада о доблестном рыцаре Айвенго — это одна из величайших приключенческих историй всех времен. Рыцарь Айвенго возвращается с крестового похода и пытается восстановить свою честь, права на свое наследство и добиться руки своей возлюбленной.  Эта историко-приключенческая сага о благородном рыцаре, который оказывается вовлеченным в яростную борьбу за английский трон между принцем Джоном и его братом королем Ричардом.";"['мелодрама', 'приключения']";['СССР'];"[256989, 'Сергей Тарасов']";"[[280804, 'Петерис Гаудиньш'], [266123, 'Тамара Акулова'], [266180, 'Борис Химичев'], [277519, 'Леонид Кулагин'], [270895, 'Ромуальд Анцанс'], [185689, 'Борис Хмельницкий'], [298328, 'Юрий Смирнов'], [122791, 'Александр Филиппенко'], [297899, 'Витаутас Томкус'], [301421, 'Альгимантас Масюлис']]";7.311;6.8;7.1;;Баллада о доблестном рыцаре Айвенго;Исторический;Приключения;Эпические саги;Классика (до 2000 года);7.311;6.8;0;DB & CSV
588839;Помпеи;;2014;18;105;https://image.openmoviedb.com/kinopoisk-images/9784475/6d794b5f-b072-4336-8ba4-0a9142f40b6d/600x900;"История любви раба Майло и благородной Кассии, обрученной с римским сенатором, на фоне извержения Везувия, которое навсегда стерло с лица земли древнеримский город Помпеи.";"['боевик', 'драма', 'мелодрама', 'приключения']";"['США', 'Канада', 'Германия', 'Великобритания']";"[38548, 'Пол У. С. Андерсон']";"[[1739589, 'Кит Харингтон'], [32615, 'Эмили Браунинг'], [39919, 'Адевале Акинойе-Агбаже'], [7131, 'Кифер Сазерленд'], [6226, 'Кэрри-Энн Мосс'], [1402, 'Джаред Харрис'], [745746, 'Джессика Лукас'], [61647, 'Карри Грэм'], [12782, 'Джо Пинг'], [481563, 'Саша Ройз']]";6.176;5.5;5.4;100000000$;Помпеи;Исторический;Боевик (Экшен);Эпические саги;Современное кино (2000–2020);6.176;5.5;4.4;DB & CSV
45609;В начале славных дел;;1980;12;138;https://image.openmoviedb.com/kinopoisk-images/6201401/d452c8d7-d6be-44c4-947c-169cc819abf9/600x900;"В конце XVII века Россия терпела убытки в торговле, потому что не имела выхода к морю. Юный российский самодержец Петр I начинает строительство флота. Тем временем, среди бояр зреет недовольство молодым монархом.";"['драма', 'история']";"['СССР', 'Германия (ГДР)']";"[220513, 'Сергей Герасимов']";"[[269781, 'Дмитрий Золотухин'], [220509, 'Тамара Макарова'], [185619, 'Наталья Бондарчук'], [238539, 'Николай Ерёменко мл.'], [307386, 'Михаил Ножкин'], [318086, 'Петер Ройссе'], [297881, 'Эдуард Бочаров'], [298011, 'Любовь Полехина'], [269650, 'Любовь Германова'], [301214, 'Анатолий Баранцев']]";8.407;7.4;7.9;;В начале славных дел;Исторический;Драма;Эпические саги;Классика (до 2000 года);8.407;7.4;0;DB & CSV
44893;Конец атамана;;1970;18;;https://image.openmoviedb.com/kinopoisk-images/10812607/ebac37fa-40e6-43e9-a18c-d3679b0de3da/600x900;"Казахстан, 20-е годы. Чекисты разрабатывают операцию по ликвидации войск белоказачьего атамана Дутова. По заданию ЧК бывший князь, племянник одного из заместителей Дутова, а ныне начальник уездной милиции Чадьяров переходит на сторону белых, и появляется в штабе атамана.  Его неоднократно проверяет и испытывает начальник дутовской контрразведки поп Иона. Каждый раз Чадьяров выигрывает опасный поединок. В конце концов он завоевывает доверие у самого Дутова. И теперь он приступает к выполнению своего боевого задания...";['драма'];['СССР'];"[335926, 'Шакен Айманов']";"[[303905, 'Асанали Ашимов'], [192779, 'Виктор Авдюшко'], [325775, 'Геннадий Юдин'], [116876, 'Юрий Саранцев'], [174306, 'Владимир Гусев'], [190103, 'Владислав Стржельчик'], [298103, 'Борис Иванов'], [298558, 'Нурмухан Жантурин'], [595803, 'Алтынай Елеуова'], [290095, 'Нуржуман Ихтымбаев']]";6.938;7.0;7.0;;Конец атамана;Исторический;Военный;Военные события;Новинки (2020–2025);6.938;7;0;DB & CSV
925176;Зима в огне;Winter on Fire;2015;;102;https://image.openmoviedb.com/kinopoisk-images/1946459/82652cd4-3e10-44d0-b4ac-dd17bcda3e53/600x900;Мирные демонстрации студентов в Украине за 93 дня переросли в насильственную революцию и полноценное движение за гражданские права.;"['документальный', 'военный', 'история']";"['Великобритания', 'Украина', 'США']";"[245723, 'Евгений Афинеевский']";"[[3690980, 'Мустафа Найем'], [1281600, 'Руслана Лыжичко'], [564018, 'Тимур Ибраимов'], [3689520, 'Владимир Макаревич'], [3690986, 'Диана Попова'], [4069756, 'Роман Савельев'], [4249157, 'Тарас Сыч'], [4249138, 'Сергей Аверченко'], [3193373, 'Богдан Дубас'], [3690981, 'Кристина Бердинских']]";6.783;8.3;7.5;;Зима в огне;Исторический;Военный;Военные события;Современное кино (2000–2020);6.783;8.3;7.5;DB & CSV
1066106;Первый король Рима;Romulus & Remus: The First King;2019;18;123;https://image.openmoviedb.com/kinopoisk-images/1600647/d3d38008-2a2e-497b-8652-4e05cf31792e/600x900;"Ромул и Рем, два брата-пастуха, отправляются в путешествие, после которого один из них станет основателем самой великой нации, а другой погибнет от рук родного брата.";"['драма', 'история', 'боевик', 'приключения']";"['Италия', 'Бельгия']";"[1157529, 'Маттео Ровере']";"[[1818134, 'Алессандро Борги'], [4431886, 'Алессио Лапиче'], [21954, 'Фабрицио Ронджоне'], [896673, 'Массимилиано Росси'], [1799428, 'Таня Гаррибба'], [1473771, 'Майкл Скерми'], [253263, 'Макс Малатеста'], [2396159, 'Винченцо Пирротта'], [3096680, 'Винченцо Креа'], [1693230, 'Лоренцо Глейджесес']]";6.018;6.5;6.3;;Первый король Рима;Исторический;Боевик (Экшен);Эпические саги;Современное кино (2000–2020);6.018;6.5;0;DB & CSV
497897;Принцесса де Монпансье;;2010;18;139;https://image.openmoviedb.com/kinopoisk-images/1599028/be1ed171-99b6-4783-ae10-37a804a4f4da/600x900;"1562 г., Францией управляет Карл IX, в стране бушуют религиозные войны... Мари де Мезьер, одна из самых богатых наследниц королевства, любит молодого герцога де Гиза, позже получившего прозвище «Меченый», и он, как ей кажется, разделяет ее чувство. Однако отец девушки, маркиз де Мезьер, стремится возвысить свою семью, и отдает дочь замуж за принца Монпансье, которого она даже не знает. Карл IX вызывает принца присоединиться к нему в борьбе с протестантами.  Франция охвачена огнем войны, и Монпансье отправляет свою молодую жену в отдаленный замок Шампиньи в сопровождении графа де Шабанна. Он поручает графу, своему бывшему наставнику и другу, завершить воспитание молодой принцессы, чтобы однажды она могла предстать при дворе. Мари старается забыть страсть, которую она по-прежнему питает к Гизу. Обстоятельства складываются таким образом, что Гиз и герцог Анжуйский, будущий король Генрих III, приезжают в Шампиньи, в то время как там находится Монпансье. Герцог Анжуйский, как и граф де Шабанн, влюбляется в принцессу… Мари становится предметом опасного и жестокого соперничества.";"['драма', 'мелодрама', 'история']";"['Франция', 'Германия', 'Бельгия']";"[46748, 'Бертран Тавернье']";"[[69088, 'Мелани Тьерри'], [22343, 'Ламбер Вильсон'], [51963, 'Гаспар Ульель'], [227436, 'Грегуар Лепренс-Ренге'], [466558, 'Рафаэль Персона'], [19497, 'Мишель Вюйермоз'], [11673, 'Филипп Маньян'], [75552, 'Флоранс Томассен'], [423184, 'Кристин Брюше'], [44983, 'Эвелина Мегханги']]";6.347;6.5;6.6;;Принцесса де Монпансье;Исторический;Мелодрама;Военные события;Современное кино (2000–2020);6.347;6.5;7;DB & CSV
