ID;Title_RU;Title_EN;Year;Age_Rating;Runtime;Image_URL;Synopsis;DB_Genres;Countries;Director;Cast;DB_Rating_1;DB_Rating_2;DB_Rating_3;Budget;CSV_Title_RU;CSV_Category_1;CSV_Category_2;CSV_Category_3;CSV_Category_4;CSV_Rating_1;CSV_Rating_2;CSV_Rating_3;Source
1060511;Зов предков;;2020;6;100;https://image.openmoviedb.com/kinopoisk-images/1773646/1f7ccff8-ce03-40eb-b4ab-bdafa44e945b/600x900;"История Бака, дружелюбного пса, чья размеренная домашняя жизнь перевернулась с ног на голову во времена золотой лихорадки в 1880-х, когда его вырвали из дома в Калифорнии и перевезли в дикую и холодную Аляску. Будучи новичком в упряжке почтовой службы, а впоследствии лидером, Бак попадает в невероятное приключение, находит свое место в мире и становится хозяином своей жизни.";"['драма', 'приключения', 'семейный']";"['США', 'Канада']";"[39366, 'Крис Сандерс']";"[[5679, 'Харрисон Форд'], [41644, 'Омар Си'], [2552849, 'Кара Ги'], [603498, 'Дэн Стивенс'], [24825, 'Брэдли Уитфорд'], [13587, 'Джин Луиза Келли'], [2582, 'Майкл Хорс'], [1235107, 'Карен Гиллан'], [3469011, 'Колин Вуделл'], [2419846, 'Мика Фицджералд']]";7.659;6.7;6.8;135000000$;Зов предков;Приключения;Семейный;Экстремальное выживание;Новинки (2020–2025);7.659;6.7;6;DB & CSV
43839;След в океане;;1964;12;83;https://image.openmoviedb.com/kinopoisk-images/1704946/355ca290-a09e-4880-be47-a50848e81d2a/600x900;"На одном из военных кораблей Северного флота недалеко от границы проходят секретные испытания нового акваланга, разработанного советским ученым. Район испытаний тщательно охраняется пограничниками. Для испытания нового акваланга собраны лучшие ныряльщики со всех флотов, за состоянием их здоровья наблюдает опытный врач, и возглавляет испытания лично изобретатель.   Уникальные возможности нового подводного дыхательного аппарата, превышающие все имеющиеся на данный момент аналоги в мире, всерьез интересуют западную разведку. Также их интересуют дневники ученого, в которых фиксируются все этапы испытаний. Для изъятия этих дневников под видом помощника врача из Москвы прилетает молодая аспирантка мединститута Балашова.";['приключения'];['СССР'];"[269515, 'Олег Николаевский']";"[[342903, 'Ада Шереметьева'], [285811, 'Юрий Дедович'], [205639, 'Евгений Весник'], [201770, 'Даниил Нетребин'], [285849, 'Павел Махотин'], [342904, 'Игорь Сретенский'], [298613, 'Геннадий Нилов'], [122806, 'Виктор Уральский'], [339905, 'Михаил Орлов'], [1915927, 'Николай Савицкий']]";5.775;6.1;5.9;;След в океане;Приключения;Драма;Экзотические путешествия;Классика (до 2000 года);5.775;6.1;0;DB & CSV
311470;Выживая с волками;;2007;12;118;https://image.openmoviedb.com/kinopoisk-images/1629390/3b992b3a-aec0-4ba7-9571-e12b0b41bd7d/600x900;"1941 год. Родители девочки Миши, скрывавшиеся в Бельгии, депортированы. Ребенок решает бежать на восток и найти их. Чтобы выжить, девочке приходится красть еду и одежду. В лесу ее спасает от гибели пара волков, переняв повадки которых, она становится полноправным членом стаи. За четыре года скитаний по охваченной огнем и залитой кровью Европе девочка открывает для себя звериную жестокость людей и доброту диких животных...";['драма'];"['Франция', 'Бельгия', 'Германия']";"[86539, 'Вера Бельмон']";"[[1309509, 'Матильда Гоффарт'], [285623, 'Яэль Абекассис'], [195288, 'Ги Бедос'], [224820, 'Мишель Бернье'], [10993, 'Бенно Фюрман'], [11683, 'Энн-Мари Филип'], [19488, 'Франк де ла Персонн'], [1515299, 'Хольгер Бонрат'], [644328, 'Патрик Шевалье'], [1388150, 'Фанни Депрелль']]";7.518;6.5;7.0;;Выживая с волками;Приключения;Биографический;Экстремальное выживание;Современное кино (2000–2020);7.518;6.5;0;DB & CSV
634300;Приключения Гекльберри Финна;;2012;6;105;https://image.openmoviedb.com/kinopoisk-images/4486362/2e3ed7a7-0f31-4b44-b5a5-3ca48e436d18/600x900;"Кто не знает Тома Сойера и Гекльберри Финна? Найдя сокровища, эти два проказника наконец разбогатели. Однако «свободный волк» Гек не может усидеть на месте. К тому же его добрый друг, чернокожий Джим, в опасности — хозяйка собирается продать его на аукционе. В компании Джима Гек отправляется мимо диких берегов Миссисипи — сначала в Каир, а потом и в Огайо, в свободную страну, не знающую рабства… А значит, впереди беглецов ждёт множество самых невероятных приключений! Будет ли счастливый конец у этой полной опасностей истории? И увидятся ли снова закадычные друзья Том Сойер и Гекльберри Финн?";"['приключения', 'семейный']";['Германия'];"[362865, 'Гермина Хунтгебурт']";"[[1816480, 'Леон Зайдель'], [774449, 'Джеки Идо'], [2526, 'Аугуст Диль'], [182476, 'Хенри Хюбхен'], [374189, 'Милан Пешель'], [228430, 'Андреас Шмидт'], [247441, 'Михаэль Гвиздек'], [1093933, 'Курт Крюмер'], [977625, 'Розалия Томас'], [1960656, 'Луис Хофман']]";6.337;5.8;6.1;6500000€;Приключения Гекльберри Финна;Приключения;Семейный;Экзотические путешествия;Классика (до 2000 года);6.337;5.8;0;DB & CSV
43261;Приключения желтого чемоданчика;;1970;0;78;https://image.openmoviedb.com/kinopoisk-images/1898899/bf008108-4936-4494-8532-e7ac262f23ae/600x900;"Мальчик Петя был таким пугливым, что его мама решила обратиться к доктору. У волшебника-доктора есть прекрасное лекарство — конфеты настоящей храбрости, но вот беда: чемоданчик с чудо-медикаментами попадает в чужие руки.";"['комедия', 'семейный', 'детский', 'фэнтези']";['СССР'];"[307680, 'Илья Фрэз']";"[[334473, 'Андрей Громов'], [196178, 'Татьяна Пельтцер'], [190116, 'Евгений Лебедев'], [307598, 'Наталья Селезнёва'], [193823, 'Борис Быстров'], [335854, 'Лариса Тихонова'], [335855, 'Виктор Тихонов'], [205639, 'Евгений Весник'], [335856, 'Константин Кунтышев'], [335857, 'Виктория Чернакова']]";8.077;6.9;7.5;;Приключения желтого чемоданчика;Приключения;Семейный;Экзотические путешествия;Классика (до 2000 года);8.077;6.9;0;DB & CSV
13593;Красное солнце;;1971;16;112;https://avatars.mds.yandex.net/get-kinopoisk-image/1600647/d2dee67a-0faf-484d-bc53-7ebd3a0fe981/600x900;"1870-е годы, Дикий Запад. Ограблен поезд и вместе с золотом похищен самурайский меч, предназначенный в подарок президенту. Самурай отправляется на поиски меча вместе с одним из грабителей, у которого свои причины искать обидчика. Тот зажал его долю награбленного, а самого грабителя чуть не убил.";"['вестерн', 'боевик']";"['Франция', 'Италия', 'Испания']";"[161512, 'Теренс Янг']";"[[104433, 'Чарльз Бронсон'], [108057, 'Тосиро Мифунэ'], [166371, 'Урсула Андресс'], [19470, 'Ален Делон'], [160467, 'Капюсин'], [173789, 'Бернабе Барта Барри'], [186476, 'Гуидо Лоллобриджида'], [147236, 'Энтони Доусон'], [186477, 'Джанни Медичи'], [159447, 'Жорж Ликан']]";7.607;6.8;7.2;;Красное солнце;Приключения;Боевик (Экшен);Поиски сокровищ;Классика (до 2000 года);7.607;6.8;0;DB & CSV
461981;Одинокий рейнджер;;2013;12;149;https://image.openmoviedb.com/kinopoisk-images/1773646/8b87a27e-b706-4d41-833a-0eab8b3cdefc/600x900;"История блюстителя закона Джона Рейда, который с помощью индейца Тонто стал легендарным мстителем в маске, стоящим на защите справедливости. Тонто с юмором и небылицами повествует о тех приключениях, которые пришлось пережить двум непохожим друг на друга героям, сведенным судьбой для того чтобы вместе сражаться против общего врага. Им приходится противостоять жадности и коррупции во времена, когда появление первых железных дорог изменило представление о власти и могуществе в мире.";"['вестерн', 'приключения', 'боевик', 'комедия']";['США'];"[30870, 'Гор Вербински']";"[[6245, 'Джонни Депп'], [1121926, 'Арми Хаммер'], [4545, 'Том Уилкинсон'], [13096, 'Уильям Фихтнер'], [1177103, 'Рут Уилсон'], [7370, 'Барри Пеппер'], [25775, 'Хелена Бонем Картер'], [2575561, 'Брайант Принц'], [22595, 'Стивен Рут'], [7411, 'Леон Риппи']]";6.789;6.4;6.0;215000000$;Одинокий рейнджер;Приключения;Боевик (Экшен);Исторические квесты;Современное кино (2000–2020);6.789;6.4;4.9;DB & CSV
43443;Акваланги на дне;;1966;12;85;https://image.openmoviedb.com/kinopoisk-images/4303601/4d1b2162-cee2-433c-963a-8f397b159f74/600x900;"Подростка из пограничного приморского поселка Ромку Марченко, как хорошего пловца, приглашают в качестве дублера исполнителя главной роли. В первый съемочный день, Ромка замечает на пляже след нарушителя границы и сообщает об этом на заставу...";"['боевик', 'приключения', 'семейный']";['СССР'];"[304635, 'Евгений Шерстобитов']";"[[327427, 'Татьяна Клюева'], [342122, 'Рафик Сабиров'], [200925, 'Геннадий Юхтин'], [331449, 'Владимир Кисленко'], [261738, 'Лев Перфилов'], [311063, 'Олег Быков'], [196089, 'Александр Гай'], [313652, 'Николай Крюков'], [342123, 'Витольд Янпавлис'], [192729, 'Дмитрий Капка']]";7.108;6.5;6.8;;Акваланги на дне;Приключения;Драма;Экстремальное выживание;Классика (до 2000 года);7.108;6.5;0;DB & CSV
468000;Клад;;1985;0;9;https://avatars.mds.yandex.net/get-kinopoisk-image/6201401/4966d848-2de2-4fc7-83d8-2cd6d81ef1fa/600x900;Компания зверушек в поисках клада обнаружила главное богатство пустыни - воду.;"['мультфильм', 'детский', 'короткометражка']";['СССР'];"[261633, 'Юрий Бутырин']";"[[1813741, 'Ирина Воронцова'], [1703280, 'Зоя Пыльнова'], [198160, 'Юрий Медведев'], [294117, 'Зинаида Нарышкина'], [337460, 'Виктор Веселкин'], [1705540, 'Игорь Егиков'], [2036382, 'Галина Дробинина'], [317816, 'Эрнст Гаман'], [1453209, 'Лидия Варенцова'], [1024567, 'Александр Костинский']]";7.78;7.0;7.4;;Клад;Приключения;Комедия;Поиски сокровищ;Новинки (2020–2025);7.78;7;0;DB & CSV
1179577;Эспен в поисках Золотого замка;The Ash Lad 2: In Search of the Golden Castle;2019;6;99;https://image.openmoviedb.com/kinopoisk-images/1600647/d76f02ba-0f38-4e4b-b6be-c567e5a134da/600x900;"Король и королева отравлены. Единственный шанс на спасение – живая вода, спрятанная на краю света в стенах таинственного Золотого замка. Эспен с принцессой Кристин отправляются в путешествие, полное опасностей и приключений.";"['фэнтези', 'приключения', 'семейный']";['Норвегия'];"[1895424, 'Миккель Бренне Сандемусе']";"[[2760623, 'Вебьёрн Энгер'], [2760624, 'Эйли Харбоэ'], [53100, 'Сидсе Бабетт Кнудсен'], [1673518, 'Мадс Сьёгор Петтерсен'], [1421572, 'Елиас Холмен'], [749438, 'Торбьорн Харр'], [233611, 'Кристиан Сколмен'], [3928006, 'Александра Йерпен'], [15602, 'Гар Б. Эйдсвольд'], [194097, 'Петронелла Баркер']]";7.056;6.3;6.7;;Эспен в поисках Золотого замка;Приключения;Фэнтези;Поиски сокровищ;Современное кино (2000–2020);7.056;6.3;0;DB & CSV
195408;Сокровище нации: Книга Тайн;National Treasure 2;2007;12;124;https://image.openmoviedb.com/kinopoisk-images/1946459/72d34283-17db-4e01-8de8-fa55e4e10994/600x900;"Охотник за сокровищами Бен Гейтс, вооружившись поддержкой любимой женщины, верного друга Райли, а также своих родителей, отправляется на поиски затерянного золотого города. Только пройдя сквозь череду невероятных и увлекательных приключений, Бену удастся очистить имя своего предка от обвинений в убийстве Авраама Линкольна. Но не все так просто – параллельные поиски города ведет и некий Митч Уилкинсон, готовый на все ради достижения цели.";"['боевик', 'триллер', 'детектив', 'приключения']";['США'];"[7035, 'Джон Тёртлтауб']";"[[6793, 'Николас Кейдж'], [34754, 'Дайан Крюгер'], [32272, 'Джастин Барта'], [515, 'Джон Войт'], [3715, 'Хелен Миррен'], [7888, 'Эд Харрис'], [1600, 'Харви Кейтель'], [7166, 'Брюс Гринвуд'], [47224, 'Тай Бурелл'], [246180, 'Майкл Мейзе']]";7.452;6.5;6.3;130000000$;Сокровище нации: Книга Тайн;Приключения;Исторический;Поиски сокровищ;Современное кино (2000–2020);7.452;6.5;4.8;DB & CSV
104122;Остаться в живых;;2004;18;;https://image.openmoviedb.com/kinopoisk-images/1773646/e44eb2d3-9a69-4d03-b851-88f694c4fd55/600x900;"Красавец-лайнер, совершающий полет из Сиднея в Лос-Анджелес, неожиданно терпит крушение. 48 пассажиров оказываются на пустынном острове посреди океана. Люди в панике.  Надежда быть найденными довольно призрачна. Поэтому остается только одно: собраться с силами и постараться выжить на острове, начиненном множеством опасностей...";"['фантастика', 'детектив', 'фэнтези', 'триллер', 'драма', 'приключения']";['США'];"[98397, 'Джек Бендер']";"[[111039, 'Мэттью Фокс'], [605598, 'Эванджелин Лилли'], [232017, 'Джош Холлоуэй'], [383, 'Терри О’Куинн'], [37437, 'Навин Эндрюс'], [24415, 'Хорхе Гарсиа'], [24147, 'Майкл Эмерсон'], [544400, 'Эмили де Рэвин'], [462427, 'Ким Юн-джин'], [24139, 'Дэниэл Дэ Ким']]";8.139;8.3;8.2;;Остаться в живых;Приключения;Драма;Экстремальное выживание;Классика (до 2000 года);8.139;8.3;0;DB & CSV
464373;Мэрайа Мунди и шкатулка Мидаса;Mariah Mundi and the Midas Box;2012;18;95;https://image.openmoviedb.com/kinopoisk-images/1599028/94ee1f85-4d34-4e14-955f-5922006d6374/600x900;"Мир семнадцатилетнего Мэрайа Мунди меняется, когда его родители внезапно исчезают, оставив юношу и его брата Феликса на произвол судьбы.";"['фэнтези', 'приключения', 'семейный']";['Испания'];"[247146, 'Джонатан Ньюман']";"[[33281, 'Майкл Шин'], [6578, 'Лина Хиди'], [22338, 'Кили Хоуз'], [4543, 'Йоан Гриффит'], [24821, 'Сэм Нил'], [1772158, 'Анайрин Барнард'], [2809155, 'Ксавьер Аткинс'], [2321303, 'Мелла Каррон'], [74662, 'Винченцо Пеллегрино'], [49687, 'Брайан Никелс']]";5.348;5.5;5.3;25000000$;Мэрайа Мунди и шкатулка Мидаса;Приключения;Фэнтези;Поиски сокровищ;Новинки (2020–2025);5.348;5.5;5;DB & CSV
557955;Черное золото;Day of the Falcon;2011;18;130;https://image.openmoviedb.com/kinopoisk-images/1599028/fc034ca0-f3da-4823-8e58-cc05656585f9/600x900;"События картины разворачиваются где-то на Аравийском полуострове в 30 годы, примерно в то время, когда там была обнаружена нефть. В сюжете переплелись борьба за власть, религия, нефтяная лихорадка и, конечно же, любовь.";"['драма', 'приключения', 'военный']";"['Франция', 'Италия', 'Катар', 'Тунис']";"[51597, 'Жан-Жак Анно']";"[[20956, 'Антонио Бандерас'], [1207951, 'Тахар Рахим'], [4067, 'Марк Стронг'], [1594998, 'Фрида Пинто'], [1079081, 'Риз Ахмед'], [566761, 'Лия Кебеде'], [12097, 'Кори Джонсон'], [1100673, 'Акин Гази'], [5054, 'Эрик Эбони'], [741496, 'Лотфи Дзири']]";7.342;6.6;6.0;40000000€;Черное золото;Приключения;Исторический;Экзотические путешествия;Современное кино (2000–2020);7.342;6.6;4;DB & CSV
95169;Остров погибших кораблей;;1987;12;138;https://image.openmoviedb.com/kinopoisk-images/4303601/9d840f94-47ed-457f-9c9c-5a53fd046d9c/600x900;"После очередной ссоры с женой герой фильма «переносится» в прошлое, где попадает в водоворот странных событий: арест по обвинению в убийстве, встреча с прекрасной Вивиан, которая так похожа на его жену, кораблекрушение.  В результате молодые люди оказываются на затерянном в океане «острове погибших кораблей». Население острова составляют моряки, пираты, путешественники. Девушке предстоит по жребию достаться одному из обитателей в жены...";"['мюзикл', 'фантастика', 'фэнтези']";['СССР'];"[276817, 'Евгений Гинзбург']";"[[281273, 'Лариса Белогурова'], [284173, 'Гедиминас Сторпирштис'], [273291, 'Николай Лавров'], [261569, 'Константин Райкин'], [100226, 'Наталья Лапина'], [307504, 'Арунас Сторпирштис'], [84341, 'Лилиан Малкина'], [231214, 'Гали Абайдулов'], [281141, 'Валентин Жиляев'], [76127, 'Сергей Паршин']]";6.88;5.7;6.3;;Остров погибших кораблей;Приключения;Фантастика;Экзотические путешествия;Классика (до 2000 года);6.88;5.7;0;DB & CSV
43147;Последний герой;;1992;12;64;https://avatars.mds.yandex.net/get-kinopoisk-image/6201401/ef4f759e-2b4a-4889-8fcb-7a7b8adb8769/600x900;"Портрет создателя группы «Кино», складываясь из размышлений и воспоминаний любивших его людей, предстает перед зрителями как музыкальное пророчество талантливого артиста о собственной жизни.";['документальный'];['Россия'];"[273009, 'Алексей Учитель']";"[[290123, 'Виктор Цой'], [1796480, 'Александр Цой'], [1754934, 'Марьяна Цой'], [1979702, 'Роберт Цой'], [1979701, 'Валентина Цой'], [1641412, 'Георгий Гурьянов'], [1050786, 'Андрей Крисанов'], [2004770, 'Елена Андреева'], [638036, 'Юрий Александров'], [290124, 'Вадим Донец']]";7.725;7.1;7.4;;Последний герой;Приключения;Боевик (Экшен);Экстремальное выживание;Новинки (2020–2025);7.725;7.1;0;DB & CSV
255325;Приключения Хомы;;1978;0;9;https://avatars.mds.yandex.net/get-kinopoisk-image/1629390/87a1984a-ef9a-4c20-b24a-7ebe45e57a04/600x900;"История о том, как ленивый хомяк Хома заставил Суслика выполнять за него все повседневные дела.";"['мультфильм', 'короткометражка']";['СССР'];"[174295, 'Гарри Бардин']";"[[261638, 'Алексей Борзунов'], [185573, 'Валерий Носик'], [270690, 'Михаил Меерович'], [1135184, 'Леонид Шварцман'], [1996000, 'Маргарита Михеева'], [310675, 'Михаил Друян'], [996210, 'Любовь Бутырина'], [301060, 'Альберт Иванов']]";7.994;7.0;7.5;;Приключения Хомы;Приключения;Семейный;Поиски сокровищ;Новинки (2020–2025);7.994;7;0;DB & CSV
