ID;Title_RU;Title_EN;Year;Age_Rating;Runtime;Image_URL;Synopsis;DB_Genres;Countries;Director;Cast;DB_Rating_1;DB_Rating_2;DB_Rating_3;Budget;CSV_Title_RU;CSV_Category_1;CSV_Category_2;CSV_Category_3;CSV_Category_4;CSV_Rating_1;CSV_Rating_2;CSV_Rating_3;Source
229931;Библиотекарь 2: Возвращение в Копи Царя Соломона;The Librarian 2 - Return To King Solomon's Mines;2006;18;92;https://avatars.mds.yandex.net/get-kinopoisk-image/1600647/3009fb8d-9e11-4ce4-a5bb-1c087c86fda6/600x900;"Флин Карсен, интеллигентный юноша, сотрудник Нью Йоркской библиотеки. Но в его душе всегда жила страсть к приключениям, тайнам и всему тому, чем грезит любой мальчишка. Однажды, ему на глаза попадается интереснейший труд о легендарных Копях Царя Соломона. Флин решает найти мифические сокровища, променяв затхлый воздух помещения и книжных клопов на дух романтики и авантюризма…";"['фэнтези', 'боевик', 'триллер', 'драма', 'мелодрама', 'комедия', 'приключения']";['США'];"[38335, 'Джонатан Фрейкс']";"[[37365, 'Ноа Уайли'], [15918, 'Габриель Анвар'], [32564, 'Боб Ньюхарт'], [64781, 'Джейн Кертин'], [64874, 'Олимпия Дукакис'], [2416, 'Эрик Авари'], [574843, 'Хаким Кае-Казим'], [135654, 'Роберт Фоксуорт'], [37028, 'Зан Маккларнон'], [7409, 'Лиза Бреннер']]";6.709;6.2;6.5;;Библиотекарь 2: Возвращение в Копи Царя Соломона;Приключения;Фэнтези;Поиски сокровищ;Современное кино (2000–2020);6.709;6.2;6.5;DB & CSV
409048;Капитан Фракасс;;1984;18;135;https://avatars.mds.yandex.net/get-kinopoisk-image/1946459/86de0b8a-b843-4c42-b3eb-e9325ff4b9fe/600x900;"Франция, 17-й век. Обедневший барон де Сигоньяк разрешает труппе странствующих актеров провести ночь в своем замке. В итоге, уставший от сельской жизни молодой барон решает отправиться вместе с ними в Париж. По пути один из актеров умирает, и де Сигонак занимает его место — начинает играть роль капитана Фракасса. Во время представления в столице молодая актриса Изабель удостаивается внимания богатого герцога. Когда она отказывает его притязаниям. Герцог угрожает похитить ее, однако сердце девушки уже принадлежит молодому барону...";['драма'];['СССР'];"[284617, 'Владимир Савельев']";"[[25248, 'Олег Меньшиков'], [284574, 'Михаил Данилов'], [185621, 'Юри Ярвет'], [298094, 'Анна Исайкина'], [176278, 'Светлана Тома'], [251207, 'Леонид Ярмольник'], [42171, 'Анастасия Бедрединова'], [285806, 'Олег Севастьянов'], [280801, 'Ивар Калныньш'], [162624, 'Всеволод Шиловский']]";7.065;6.6;6.8;;Капитан Фракасс;Приключения;Комедия;Исторические квесты;Классика (до 2000 года);7.065;6.6;0;DB & CSV
6034;Невероятная жизнь Уолтера Митти;;2013;12;114;https://image.openmoviedb.com/kinopoisk-images/4774061/cb778377-a57b-48f4-9c90-7a037880ae39/600x900;"Уолтер Митти — сотрудник отдела иллюстраций журнала Life. Его работа — сплошная рутина, хотя в своих мечтах он уносится очень далеко. В присланных фотографом Шоном О’Коннелом негативах для обложки журнала не хватает одного кадра. Единственный шанс получить фотографию — найти самого Шона. И Уолтер отправляется в долгое путешествие.";"['комедия', 'приключения', 'фэнтези', 'драма', 'мелодрама']";"['США', 'Великобритания']";"[9208, 'Бен Стиллер']";"[[9208, 'Бен Стиллер'], [462584, 'Кристен Уиг'], [38445, 'Адам Скотт'], [26740, 'Ширли Маклейн'], [31708, 'Кэтрин Хан'], [1293, 'Шон Пенн'], [20448, 'Пэттон Освальт'], [29847, 'Адриан Мартинес'], [19913, 'Оулавюр Дарри Оулафссон'], [2940804, 'Маркус Анттури']]";7.724;7.3;7.0;90000000$;Невероятная жизнь Уолтера Митти;Приключения;Комедия;Экзотические путешествия;Современное кино (2000–2020);7.724;7.3;6;DB & CSV
45271;Земля Санникова;The Land of Sannikov;1973;6;95;https://avatars.mds.yandex.net/get-kinopoisk-image/10703859/34a5a3e1-0681-4367-8be1-d359ab2f22b7/600x900;"Более ста лет загадка земли, затерянной среди арктических льдов, волновала путешественников, но никто не мог достичь ее. Герой фильма, политический ссыльный Ильин, отправляется в экспедицию, которую финансирует богатый золотопромышленник.  Отважные путешественники обнаруживают среди ледяного безмолвия цветущий оазис. Но выясняется, что во время землетрясения он должен исчезнуть. Ильин с товарищами стремится снова достичь материка в попытке предотвратить катастрофу...";['приключения'];['СССР'];"[273254, 'Альберт С. Мкртчян']";"[[185622, 'Владислав Дворжецкий'], [179092, 'Георгий Вицин'], [318192, 'Олег Даль'], [139211, 'Юрий Назаров'], [328815, 'Махмуд Эсамбаев'], [324141, 'Николай Гриценко'], [331523, 'Алена Чухрай'], [331522, 'Геворк Чепчян'], [307588, 'Петр Абашеев'], [331525, 'Турсун Куралиев']]";7.705;6.9;7.3;;Земля Санникова;Приключения;Фантастика;Поиски сокровищ;Классика (до 2000 года);7.705;6.9;0;DB & CSV
82273;Приключения Десперо;;2008;0;93;https://image.openmoviedb.com/kinopoisk-images/1900788/b1c4e551-a455-4b49-be30-412fa2677204/600x900;"Это история о трёх существах, менее всего подходящих на роли героев — Мыши, предпочитающей читать книги, вместо того, чтобы есть их; Крысы, плетущей интриги ради того, чтобы навсегда покинуть сырую темницу; и лопоухой девочки — чьи судьбы переплетаются с неисповедимыми путями Принцессы.";"['мультфильм', 'фэнтези', 'комедия', 'приключения', 'семейный']";"['Великобритания', 'США', 'Австрия']";"[582910, 'Сэм Фелл']";"[[10968, 'Мэттью Бродерик'], [22234, 'Дастин Хоффман'], [40779, 'Эмма Уотсон'], [8089, 'Трейси Ульман'], [21491, 'Кевин Клайн'], [11360, 'Уильям Х. Мэйси'], [12028, 'Стэнли Туччи'], [14570, 'Киран Хайндс'], [24216, 'Робби Колтрейн'], [234665, 'Тони Хейл']]";6.583;6.1;6.1;60000000$;Приключения Десперо;Приключения;Семейный;Поиски сокровищ;Новинки (2020–2025);6.583;6.1;5.7;DB & CSV
25083;Особо важное задание;;1980;12;138;https://avatars.mds.yandex.net/get-kinopoisk-image/1704946/afb673ce-669e-4fec-aa40-1ff6613a5af0/600x900;"О героизме тружеников тыла во время Великой Отечественной войны. Работники крупного авиационного завода, оказавшись в эвакуации и ни на минуту не останавливая производство самолетов, буквально на пустом месте возводят новый завод...";"['драма', 'военный']";['СССР'];"[266120, 'Евгений Матвеев']";"[[266120, 'Евгений Матвеев'], [318006, 'Валерия Заклунная'], [174125, 'Людмила Гурченко'], [174233, 'Николай Крючков'], [174123, 'Владимир Самойлов'], [321316, 'Петр Чернов'], [200925, 'Геннадий Юхтин'], [304419, 'Евгений Киндинов'], [36393, 'Евгений Лазарев'], [200868, 'Лев Борисов']]";6.75;6.6;6.7;;Особо важное задание;Приключения;Детектив;Поиски сокровищ;Классика (до 2000 года);6.75;6.6;0;DB & CSV
45382;Золотая речка;;1977;18;97;https://avatars.mds.yandex.net/get-kinopoisk-image/1599028/3f11b740-737b-42ff-84ac-1ecf5f7a5b18/600x900;"Продолжение фильма «Пропавшая экспедиция». На этот раз события разворачиваются в 1923 году. Герои фильма вновь попадают в те места, где было найдено богатое месторождение золота. Однако добраться до него оказывается не проще, чем несколько лет назад…";['приключения'];['СССР'];"[301063, 'Вениамин Дорман']";"[[224537, 'Александр Абдулов'], [174203, 'Николай Горлов'], [107524, 'Александр Кайдановский'], [277246, 'Юрий Каюров'], [290302, 'Андрей Харыбин'], [245736, 'Георгий Мартиросян'], [290078, 'Ольга Матешко'], [256952, 'Николай Олялин'], [269782, 'Сергей Сазонтьев'], [266195, 'Виктор Сергачев']]";7.339;6.8;7.1;;Золотая речка;Приключения;Семейный;Поиски сокровищ;Новинки (2020–2025);7.339;6.8;0;DB & CSV
5565;Хозяин морей: На краю Земли;Master and Commander;2003;12;138;https://image.openmoviedb.com/kinopoisk-images/1900788/66209f22-22b7-4c53-af66-63d42d18c34d/600x900;"Действие фильма разворачивается во время наполеоновских войн. Военный парусник Ее Величества «Сюрприз», бороздящий просторы Атлантики, был неожиданно атакован огромным неизвестным кораблем, появившимся из тумана. Благодаря смелости и находчивости команды «Сюрпризу» удается уйти от смерти. Несмотря на тяжелые повреждения и потери, капитан Джек Обри по прозвищу Счастливчик принимает решение преследовать врага и устремляется в погоню, которая уведет его на край света. На кону репутация Джека, его жизнь и жизнь его команды…";"['боевик', 'драма', 'приключения', 'военный', 'история']";['США'];"[63414, 'Питер Уир']";"[[10019, 'Рассел Кроу'], [14363, 'Пол Беттани'], [53295, 'Джеймс Д’Арси'], [47211, 'Эдвард Вудалл'], [20634, 'Крис Ларкин'], [456314, 'Макс Пиркис'], [475996, 'Джек Рэндалл'], [456313, 'Макс Бениц'], [16191, 'Ли Инглби'], [475997, 'Ричард Пейтс']]";7.63;7.5;7.6;150000000$;Хозяин морей: На краю Земли;Приключения;Военный;Экзотические путешествия;Современное кино (2000–2020);7.63;7.5;7.6;DB & CSV
46420;Неуловимые мстители;;1966;6;74;https://image.openmoviedb.com/kinopoisk-images/4303601/9f8849a0-9ca4-4337-8a11-30d14683e2c3/600x900;"Бывший гимназист Валерка, веселый отчаянный Яшка-цыган, оставшиеся сиротами Данька и его сестренка Ксанка дали клятву внедриться в отряд к атаману Бурнашу и отомстить ему и его банде за смерть отца Даньки. Под видом сына старого друга атамана Данька проникает в отряд Бурнаша. Однако бандиты сумели узнать об этом. Даньку ждет казнь, но друзья на то и друзья, чтобы не бросить своего товарища в беде.";"['боевик', 'вестерн', 'военный', 'приключения']";['СССР'];"[294932, 'Эдмонд Кеосаян']";"[[273366, 'Виктор Косых'], [190115, 'Ефим Копелян'], [284424, 'Владимир Трещалов'], [95945, 'Борис Сичкин'], [102548, 'Савелий Крамаров'], [268137, 'Владимир Белокуров'], [128152, 'Инна Чурикова'], [181147, 'Василий Васильев'], [334604, 'Валентина Курдюкова'], [328788, 'Михаил Метёлкин']]";8.083;7.3;7.7;;Неуловимые мстители;Приключения;Военный;Исторические квесты;Классика (до 2000 года);8.083;7.3;0;DB & CSV
606753;Жил-был Тигр;Once There Was a Tiger;2012;12;132;https://image.openmoviedb.com/kinopoisk-images/10768063/ba6eb88e-7f6e-4e4c-8281-5fe7ae6bc7fb/600x900;"Индийский спецагент по прозвищу Тигр во время очередной миссии влюбляется в очаровательную танцовщицу Зою — помощницу ученого, который подозревается в продаже секретных технологий пакистанской разведке.";"['боевик', 'мелодрама']";['Индия'];"[1101159, 'Кабир Кхан']";"[[237589, 'Салман Кхан'], [225060, 'Катрина Каиф'], [249792, 'Гириш Карнад'], [545995, 'Ранвир Шори'], [10316, 'Рошан Сет'], [2227285, 'Гави Чахал'], [404765, 'Раджендра Сетхи'], [3383786, 'Авинаш Бадал'], [1084761, 'Бхупеш Сингх'], [3361883, 'Санджай Гурбаксани']]";7.638;5.7;6.4;;Жил-был тигр;Приключения;Драма;Экстремальное выживание;Современное кино (2000–2020);7.638;5.7;5.9;DB & CSV
4374;Пираты Карибского моря: Проклятие Черной жемчужины;Pirates Of The Caribbean ‐ The Curse of the Black Pearl;2003;12;143;https://image.openmoviedb.com/kinopoisk-images/1773646/d7e3dbd6-e4a9-4485-b751-d02f49825166/600x900;"Жизнь харизматичного авантюриста, капитана Джека «Воробья», полная увлекательных приключений, резко меняется, когда его заклятый враг — капитан Барбосса — похищает корабль Джека, «Чёрную жемчужину», а затем нападает на Порт Ройал и крадёт прекрасную дочь губернатора, Элизабет Свонн. Друг детства Элизабет, Уилл Тернер, вместе с Джеком возглавляет спасательную экспедицию на самом быстром корабле Британии, в попытке вызволить девушку из плена и заодно отобрать у злодея «Чёрную жемчужину». Вслед за этой парочкой отправляется амбициозный коммодор Норрингтон, который к тому же числится женихом Элизабет. Однако Уилл не знает, что над Барбоссой висит вечное проклятие, при лунном свете превращающее его с командой в живых скелетов. Проклятье будет снято лишь тогда, когда украденное золото Ацтеков будет возвращено пиратами на старое место.";"['фэнтези', 'боевик', 'приключения']";['США'];"[30870, 'Гор Вербински']";"[[6245, 'Джонни Депп'], [24683, 'Джеффри Раш'], [30875, 'Орландо Блум'], [24302, 'Кира Найтли'], [3695, 'Джек Девенпорт'], [8630, 'Кевин Макнэлли'], [15074, 'Джонатан Прайс'], [23731, 'Ли Аренберг'], [30876, 'Макензи Крук'], [10038, 'Дэвид Бэйли']]";8.381;8.1;7.9;140000000$;Пираты Карибского моря: Проклятие черной жемчужины;Приключения;Фэнтези;Поиски сокровищ;Современное кино (2000–2020);8.381;8.1;7.1;DB & CSV
675477;Полярный рейс;;2013;12;88;https://image.openmoviedb.com/kinopoisk-images/1629390/c6dedccc-d556-41cf-9b82-bcd10110c8df/600x900;"Иногда расстояние, карьера и работа разлучают людей навсегда. А по-настоящему родных — только на миг, сколько бы он ни длился. Может случиться, что симпатичный пушистый амулет сведёт вместе героев и заставит одних проявить юмор, благородство, преданность и взаимопомощь, других — быть просто смешными, глупыми и опасными… Пройдя через разлуку, череду преград, испытаний и искушений, волшебство любви должно победить!";['комедия'];['Украина'];"[1689797, 'Сергей Чекалов']";"[[566942, 'Егор Бероев'], [1205093, 'Юлия Снигирь'], [551325, 'Дмитрий Нагиев'], [273448, 'Татьяна Орлова'], [1478309, 'Анна Семенович'], [238750, 'Михаил Тарабукин'], [1552163, 'Кирилл Жандаров'], [1235076, 'Юлия Куварзина'], [1140369, 'Поля Полякова'], [1615047, 'Юлия Галкина']]";4.221;3.5;3.9;;Полярный рейс;Приключения;Драма;Экстремальное выживание;Классика (до 2000 года);4.221;3.5;0;DB & CSV
3950;Лара Крофт: Расхитительница гробниц;Tomb Raider;2001;18;100;https://image.openmoviedb.com/kinopoisk-images/4486454/36055fa2-1f8e-4913-9f6e-bd18d5ba91a8/600x900;"Она владеет всеми видами рукопашного боя, стреляет из любых видов оружия и способна выжить в самых экстремальных условиях. Эта девушка - дочь лорда, леди Лара Крофт. Однажды под лестницей она обнаруживает вход в секретную комнату, где находятся старинные часы с удивительным устройством внутри.";"['фэнтези', 'боевик', 'триллер', 'приключения']";"['США', 'Великобритания', 'Япония', 'Германия']";"[24639, 'Саймон Уэст']";"[[20866, 'Анджелина Джоли'], [515, 'Джон Войт'], [50311, 'Иэн Глен'], [7227, 'Ноа Тейлор'], [14188, 'Дэниэл Крэйг'], [50312, 'Ричард Джонсон'], [31542, 'Крис Барри'], [22781, 'Джулиан Райнд-Татт'], [6627, 'Лесли Филлипс'], [50313, 'Роберт Филлипс']]";6.833;5.8;5.5;115000000$;Лара Крофт: Расхитительница гробниц;Приключения;Боевик (Экшен);Поиски сокровищ;Современное кино (2000–2020);6.833;5.8;4;DB & CSV
45733;Вертикаль;Vertical;1966;0;73;https://image.openmoviedb.com/kinopoisk-images/1599028/27c7bfda-6033-4972-87c2-ac8b528f6d69/600x900;"Группе альпинистов, идущих на штурм непокоренной кавказской вершины, пика Ор-Тау, послан сигнал о немедленном возвращении: надвигается грозовой циклон. Связист скрывает от товарищей это предупреждение, и они оказываются в критической ситуации. Трагедии удается избежать только благодаря мужеству спасателей и опыту самих спортсменов...";['приключения'];['СССР'];"[303878, 'Борис Дуров']";"[[295039, 'Владимир Высоцкий'], [341110, 'Маргарита Кошелева'], [269566, 'Геннадий Воропаев'], [337617, 'Александр Фадеев'], [341111, 'Георгий Кулбуш'], [303859, 'Лариса Лужина'], [269835, 'Бухути Закариадзе'], [341112, 'М. Анучринов'], [341113, 'Л. Глисеев'], [1144297, 'Л. Кахилин']]";7.575;6.9;7.2;;Вертикаль;Приключения;Драма;Экстремальное выживание;Классика (до 2000 года);7.575;6.9;0;DB & CSV
43255;Приключения Кроша;;1962;0;81;https://avatars.mds.yandex.net/get-kinopoisk-image/1946459/e14229c4-a1d4-4fb5-a576-ef8c87e7d20d/600x900;"Ученики девятого класса одной из московских школ проходят летнюю практику на крупной автобазе. Быстро освоившись с организацией незамысловатого труда ремонтника, ребята выбирают в своем дружном коллективе снабженца — и каждый находит практику в чем-то полезной. Только Сережа Крашенинников (Крош) со своими гуманитарными способностями и полным отсутствием интереса к технике, явно выбивается из дружного коллектива. Но происходит ЧП: со склада пропадает новенький амортизатор, а затем и машина. И наблюдательный Крош берет на себя функции детектива...";"['приключения', 'семейный']";['СССР'];"[344956, 'Генрих Оганисян']";"[[298390, 'Николай Томашевский'], [84759, 'Андрей Юренев'], [101749, 'Никита Михалков'], [1492457, 'И. Погребенко'], [1492458, 'Вера Белякова'], [1492459, 'Е. Логинова'], [1492460, 'В. Суханов'], [1492461, 'М. Сусьев'], [342140, 'Светлана Балашова'], [192795, 'Николай Парфёнов']]";6.875;6.4;6.6;;Приключения Кроша;Приключения;Семейный;Экстремальное выживание;Классика (до 2000 года);6.875;6.4;0;DB & CSV
