ID;Title_RU;Title_EN;Year;Age_Rating;Runtime;Image_URL;Synopsis;DB_Genres;Countries;Director;Cast;DB_Rating_1;DB_Rating_2;DB_Rating_3;Budget;CSV_Title_RU;CSV_Category_1;CSV_Category_2;CSV_Category_3;CSV_Category_4;CSV_Rating_1;CSV_Rating_2;CSV_Rating_3;Source
71046;Как три мушкетера;;1984;12;180;https://avatars.mds.yandex.net/get-kinopoisk-image/1773646/3142fcf8-7e8a-4c6d-a482-0e8063615e91/600x900;"Индийский вариант саги о трех мушкетерах. Вместо короля — великий махараджа, вместо французов — индусы. Но интрига отнюдь не уступает замыслу Александра Дюма! Правитель убит, власть и его несметные богатства стали причиной раздора. Темные силы пытаются во что бы то ни стало прибрать все это к своим рукам… Отважная троица противостоит силам зла и в неравной схватке пытается спасти страну, несметные сокровища и, естественно, свои жизни!";"['мелодрама', 'приключения']";['Индия'];"[260153, 'Прамод Чакраворти']";"[[272302, 'Дхармендра'], [225062, 'Зинат Аман'], [255162, 'Митхун Чакраборти'], [313155, 'Шома Ананд'], [74447, 'Дэнни Дензонгпа'], [230600, 'Бина'], [275985, 'Ранджит'], [283623, 'Бхарат Бхушан'], [250593, 'Бирбал'], [300670, 'Р.С. Чопра']]";7.039;6.3;6.7;;Как три мушкетера;Приключения;Исторический;Исторические квесты;Новинки (2020–2025);7.039;6.3;0;DB & CSV
84472;Копи царя Соломона;;2004;12;;https://image.openmoviedb.com/kinopoisk-images/9784475/b6c32566-a27a-4468-9edd-1f86b3536ea6/600x900;"Одни говорили, что нашедший эти копи станет богатейшим человеком на земле. Другие — что его постигнет страшное проклятье. Но никто из тех, кто уходил на их поиски, не вернулся назад. Одним из таких отважных искателей приключений, бесследно исчезнувших на просторах Африканского континента, оказался отец красавицы Элизабет.";"['фэнтези', 'боевик', 'мелодрама', 'приключения']";"['США', 'Германия', 'ЮАР']";"[65706, 'Стив Бойум']";"[[9865, 'Патрик Суэйзи'], [102934, 'Элисон Дуди'], [177530, 'Рой Мэрсден'], [13196, 'Джон Стэндинг'], [72252, 'Гэвин Худ'], [6101, 'Сидеде Оньюло'], [14193, 'Йен Робертс'], [14192, 'Ник Борэйни'], [574843, 'Хаким Кае-Казим'], [916084, 'Леседи Могоэтл']]";7.225;6.0;6.6;;Копи царя Соломона;Приключения;Фэнтези;Поиски сокровищ;Классика (до 2000 года);7.225;6;0;DB & CSV
13954;Остров головорезов;;1995;12;124;https://avatars.mds.yandex.net/get-kinopoisk-image/1599028/a6f2df5c-a309-495c-bda3-bdaa256931a1/600x900;"1668 год, Ямайка. Отважная дочь пирата Морган Эдамс (Джина Дэвис) получила в наследство от отца, погибшего от рук собственного брата, треть карты Острова Головорезов с обозначением места, где спрятаны несметные сокровища. Чтобы добраться до них, Морган набирает команду из товарищей отца. На аукционе рабов в Порт-Ройале на Ямайке она покупает очаровательного и чертовски обаятельного проходимца Уильяма Шоу (Мэттью Модин), у которого оказывается вторая часть карты. А третья, последняя часть карты, находится у злого и коварного дяди Морган, — пирата по прозвищу «Дог» (Фрэнк Ланджелла).";"['боевик', 'комедия', 'приключения']";"['США', 'Франция', 'Италия', 'Германия']";"[25060, 'Ренни Харлин']";"[[21361, 'Джина Дэвис'], [11066, 'Мэттью Модайн'], [16744, 'Фрэнк Ланджелла'], [3561, 'Мори Чайкин'], [10368, 'Патрик Мэлахайд'], [65502, 'Стэн Шоу'], [23984, 'Рекс Линн'], [13453, 'Пол Диллон'], [49216, 'Кристофер Мастерсон'], [37867, 'Джимми Ф. Скэггз']]";7.076;5.7;5.9;98000000$;Остров головорезов;Приключения;Боевик (Экшен);Поиски сокровищ;Классика (до 2000 года);7.076;5.7;4.9;DB & CSV
10023;Золото Маккенны;;1968;12;128;https://image.openmoviedb.com/kinopoisk-images/1629390/41cda8f0-a154-43cd-9fea-19713e798b12/600x900;"1874 год. Гедлибергский шериф Маккенна в случайной стычке убивает старика «Койота» - одного из апачских вождей. У «Койота» шериф находит план местонахождения Золотого Каньона, где, согласно легенде, находятся несметные золотые россыпи. Легенда гласит, что это золото апачи нашли много лет назад. Оно охраняется духами. И пока апачи его не тронут, они будут сильны. Многие предпринимали попытки найти это золото. Легенда также рассказывает о том, как некий Адамс нашёл каньон, но апачи поймали его и выжгли глаза, чтобы он не смог никого привести туда. С тех пор Золотой Каньон (свое имя Дель Оро он получил от конкистадоров, не сумевших его отыскать) называют и Каньоном Слепого Адамса. Полученную карту Маккенна сжигает...";"['мелодрама', 'вестерн', 'приключения']";['США'];"[136368, 'Дж. Ли Томпсон']";"[[91625, 'Грегори Пек'], [20967, 'Омар Шариф'], [20141, 'Телли Савалас'], [116698, 'Камилла Спарв'], [149383, 'Кинен Уинн'], [59469, 'Джули Ньюмар'], [176948, 'Тед Кэссиди'], [182756, 'Ли Дж. Кобб'], [189349, 'Рэймонд Мэсси'], [91623, 'Бёрджесс Мередит']]";7.718;6.7;6.6;7000000$;Золото Маккенны;Приключения;Исторический;Поиски сокровищ;Классика (до 2000 года);7.718;6.7;5.3;DB & CSV
1011;Только у ангелов есть крылья;;1939;12;121;https://avatars.mds.yandex.net/get-kinopoisk-image/1946459/5339527e-1a60-4bdf-a81c-e1f835223327/600x900;"Храбрые американские летчики на быстрокрылых машинах стараются изо всех сил заработать свой кровный доллар в почтовой авиакомпании Джеффа Картера. Дружный коллектив расположился на одном из аэродромов Перу. Помимо работы, здесь кипят нешуточные человеческие и любовные страсти…";"['драма', 'мелодрама', 'приключения']";['США'];"[160426, 'Ховард Хоукс']";"[[154898, 'Кэри Грант'], [187831, 'Джин Артур'], [200646, 'Ричард Бартелмесс'], [106173, 'Рита Хэйворт'], [198229, 'Томас Митчелл'], [204700, 'Эллин Джослин'], [193325, 'Сиг Руман'], [209419, 'Виктор Килиан'], [195003, 'Джон Кэрролл'], [165478, 'Дон ’Красный’ Барри']]";7.21;7.6;7.8;;Только у ангелов есть крылья;Приключения;Драма;Экстремальное выживание;Классика (до 2000 года);7.21;7.6;8.7;DB & CSV
462059;Круиз по джунглям;Jungle Cruise (2021);2021;12;127;https://image.openmoviedb.com/kinopoisk-images/1898899/8c65d6b2-4554-4d86-b70a-c046af13a1a0/600x900;"Хитростью и немалой сноровкой раздобыв бесценную карту верховьев Амазонки, бойкая археолог Лили Хоутон отправляется в экспедицию, чтобы найти волшебное дерево, цветок которого — согласно легенде — обладает невероятными целебными свойствами. Прихватив с собой младшего брата, который не в восторге от перспективы поездки в дикие джунгли, девушка нанимает проводника — капитана круизного пароходика по имени Фрэнк. Вся компания пускается в приключение, где их подстерегают не только смертельно опасные представители амазонской флоры и фауны, но и ловушки, подстроенные участниками конкурирующей экспедиции.";"['приключения', 'комедия', 'фэнтези']";"['США', 'Австралия', 'Италия', 'Новая Зеландия', 'Венгрия', 'Канада']";"[541691, 'Жауме Кольет-Серра']";"[[227068, 'Эмили Блант'], [31969, 'Дуэйн Джонсон'], [230380, 'Эдгар Рамирес'], [1927372, 'Джек Уайтхолл'], [21391, 'Джесси Племонс'], [12591, 'Пол Джаматти'], [1208642, 'Вероника Фалькон'], [14461, 'Энди Найман'], [2656257, 'Филипп Максимилиан'], [2273435, 'Дани Ровира']]";6.836;6.5;6.4;200000000$;Круиз по джунглям;Приключения;Фэнтези;Экзотические путешествия;Новинки (2020–2025);6.836;6.5;6;DB & CSV
42978;Пираты ХХ века;;1979;18;86;https://image.openmoviedb.com/kinopoisk-images/1777765/20e55697-563c-4174-b502-6b46bd8e9ae0/600x900;"Советский сухогрузный корабль перевозил большой груз опиума для фармакологической промышленности. Современные пираты, охотившиеся за ценным грузом, коварством завладели кораблем и экипажем.  Чтобы не осталось свидетелей этого разбойного нападения, пираты попытались уничтожить всю команду корабля. В океанских просторах разыгралась напряженная борьба между горсткой советских моряков и современными разбойниками, не знающими пощады.";"['боевик', 'триллер', 'криминал', 'приключения']";['СССР'];"[303878, 'Борис Дуров']";"[[238539, 'Николай Ерёменко мл.'], [266189, 'Пётр Вельяминов'], [310473, 'Талгат Нигматулин'], [310654, 'Рейн Арен'], [294241, 'Дилором Камбарова'], [266130, 'Наталья Хорохорина'], [322174, 'Джигангир Шахмурадов'], [322175, 'Юрий Кутырев'], [322176, 'Тадеуш Касьянов'], [322177, 'Майя Эглите']]";7.453;6.6;7.0;;Пираты ХХ века;Приключения;Боевик (Экшен);Экзотические путешествия;Классика (до 2000 года);7.453;6.6;0;DB & CSV
195397;Водопад Ангела;;2006;18;115;https://image.openmoviedb.com/kinopoisk-images/4483445/2e7b87a2-f23c-4d40-ba1d-b93f09e0f7d2/600x900;"Гражданская война закончена, но не для всех. Небольшой отряд наемных стрелков, возглавляемый бывшим полковником армии Конфедератов Карвером, преследует экс-капитана армии Северян Гидеона. Погоня длится не один день, Гидеон ранен и обессилен, но по-прежнему опережает своих врагов. Что пробудило столь сильную ненависть Карвера, остается загадкой.";"['боевик', 'триллер', 'драма', 'вестерн', 'военный']";['США'];"[244435, 'Дэвид Фон Энкен']";"[[6534, 'Лиам Нисон'], [9931, 'Пирс Броснан'], [38052, 'Майкл Уинкотт'], [30293, 'Роберт Бэйкер'], [11649, 'Ксандер Беркли'], [14761, 'Эд Лотер'], [12648, 'Том Нунэн'], [20766, 'Кевин Дж. О’Коннор'], [227205, 'Джон Робинсон'], [28296, 'Анжелика Хьюстон']]";6.922;6.6;6.4;18000000$;Водопад Ангела;Приключения;Драма;Экзотические путешествия;Новинки (2020–2025);6.922;6.6;5.7;DB & CSV
195397;Водопад Ангела;;2006;18;115;https://image.openmoviedb.com/kinopoisk-images/4483445/2e7b87a2-f23c-4d40-ba1d-b93f09e0f7d2/600x900;"Гражданская война закончена, но не для всех. Небольшой отряд наемных стрелков, возглавляемый бывшим полковником армии Конфедератов Карвером, преследует экс-капитана армии Северян Гидеона. Погоня длится не один день, Гидеон ранен и обессилен, но по-прежнему опережает своих врагов. Что пробудило столь сильную ненависть Карвера, остается загадкой.";"['боевик', 'триллер', 'драма', 'вестерн', 'военный']";['США'];"[244435, 'Дэвид Фон Энкен']";"[[6534, 'Лиам Нисон'], [9931, 'Пирс Броснан'], [38052, 'Майкл Уинкотт'], [30293, 'Роберт Бэйкер'], [11649, 'Ксандер Беркли'], [14761, 'Эд Лотер'], [12648, 'Том Нунэн'], [20766, 'Кевин Дж. О’Коннор'], [227205, 'Джон Робинсон'], [28296, 'Анжелика Хьюстон']]";6.922;6.6;6.4;18000000$;Водопад Ангела;Приключения;Драма;Экзотические путешествия;Новинки (2020–2025);6.922;6.6;5.7;DB & CSV
94628;Необыкновенные приключения Карика и Вали;;1987;12;128;https://image.openmoviedb.com/kinopoisk-images/1900788/2acc0996-fa50-40ba-9df3-e7b4ec9986ec/600x900;"Фантазия на тему одноименной повести Яна Ларри. Брат и сестра Карик и Валя, выпив загадочный эликсир, изобретенный профессором Енотовым, уменьшаются настолько, что стрекоза уносит их на пруд. Дети попадают в необыкновенный, удивительно интересный мир насекомых.";"['фантастика', 'фэнтези', 'приключения', 'детский']";['СССР'];"[273284, 'Валерий Родченко']";"[[266224, 'Василий Ливанов'], [699539, 'Анна Дикуль'], [699540, 'Алексей Черцов'], [134166, 'Елена Попова'], [231207, 'Ольга Волкова'], [269888, 'Михаил Светин'], [301102, 'Аркадий Шалолашвили'], [251207, 'Леонид Ярмольник'], [231215, 'Аркадий Коваль'], [287365, 'Владимир Воробьев']]";6.891;6.2;6.5;;Необыкновенные приключения Карика и Вали;Приключения;Фантастика;Экзотические путешествия;Классика (до 2000 года);6.891;6.2;0;DB & CSV
863271;Над глубиной: Хроника выживания;;2016;18;80;https://image.openmoviedb.com/kinopoisk-images/1946459/2333e149-43fd-41a4-8390-1f529253eeb3/600x900;Три американских студента решили записать на видео свой экстремальный отдых: глубоководное погружение в клетке к большой белой акуле в Южной Австралии. Весёлое приключение – такой забавой это казалось для друзей. Но катастрофический поворот событий расставил всё по своим местам: друзья оказались в открытом море наедине с большой белой акулой.;"['ужасы', 'триллер', 'драма', 'приключения']";['Австралия'];"[2641122, 'Джералд Рашионато']";"[[2931772, 'Джоэль Хоган'], [2858214, 'Джош Поттхофф'], [2979772, 'Меган Пета Хилл'], [3272893, 'Пит Вэлли'], [4094599, 'Марк Фелл'], [63755, 'Кристофер Коллен'], [3358688, 'Тара Рэйт'], [590630, 'Крис Бэс'], [1610916, 'Тришиа Брукс'], [1474926, 'Сюзанн Дервиш-Али']]";4.902;4.2;4.2;;Над глубиной: Хроника выживания;Приключения;Триллер;Экстремальное выживание;Новинки (2020–2025);4.902;4.2;3.4;DB & CSV
60380;Война динозавров;Dragon Wars;2007;12;100;https://image.openmoviedb.com/kinopoisk-images/1599028/ef5ea1f3-2012-4590-9f2d-aa0160497c62/600x900;"Согласно древней корейской легенде, ужасные создания Имуги вернутся и разрушат планету. Репортер Итан Кендрик, занимающийся расследованием обстоятельств дела, приходит к выводу, что ему может помочь девушка Сара, пораженная таинственной болезнью. Тем временем Имуги приближаются к Лос-Анджелесу, сея на своем пути хаос и разруху. Успеют ли Итан и Сара спасти жителей города, пока еще не слишком поздно…";"['ужасы', 'фэнтези', 'боевик', 'триллер', 'драма']";"['Корея Южная', 'США']";"[61660, 'Щим Хён-нэ']";"[[28871, 'Джейсон Бер'], [237903, 'Аманда Брукс'], [6148, 'Роберт Форстер'], [583874, 'Крэйг Робинсон'], [36458, 'Эйми Гарсиа'], [14667, 'Крис Малки'], [54805, 'Джон Алес'], [14111, 'Элизабет Пенья'], [231573, 'Билли Гарделл'], [2794, 'Холмс Осборн']]";3.669;3.5;3.7;32000000$;Война динозавров;Приключения;Фантастика;Экстремальное выживание;Новинки (2020–2025);3.669;3.5;4;DB & CSV
636356;На Байкал;;2011;16;87;https://image.openmoviedb.com/kinopoisk-images/1599028/0f8e61a5-2c3e-4979-9fc6-a29369cdf078/600x900;"Валентину, студенту института кинематографии Санкт-Петербурга, в качестве дипломной работы предстоит снять документальный фильм о Байкале. Его друзья напоминают ему о Степане, бывшем одногруппнике из Улан-Удэ. Он решает обратиться к нему за помощью.  В Улан-Удэ вместе со своими друзьями ребята попадают в различные курьезные ситуации. В течение трех дней они отдыхают на Байкале в Чивыркуйском заливе, помогают Валентину в съемках документального фильма и рассказывают о всех красотах «священного моря».";"['мелодрама', 'комедия']";['Россия'];"[2638038, 'Михаил Козлов']";"[[2638055, 'Сергей Никонов'], [2728967, 'Евгений Жамцуев'], [2638038, 'Михаил Козлов'], [2728972, 'Александр Хамнушкин'], [722407, 'Максим Покровский'], [916794, 'Евгений Ганелин'], [2728973, 'Дарья Прокопьева'], [2728974, 'Мария Галимова'], [2728975, 'Юлиана Шкабарова'], [2728976, 'Юлия Борисова']]";6.164;5.0;5.6;;На Байкал;Приключения;Драма;Экзотические путешествия;Новинки (2020–2025);6.164;5;0;DB & CSV
38904;Индиана Джонс и Королевство хрустального черепа;Indiana Jones 4;2008;16;123;https://image.openmoviedb.com/kinopoisk-images/4486362/663e6b4d-81c2-4f3e-a2f0-f0dffa979419/600x900;"1957 год, разгар холодной войны. Советские солдаты, возглавляемые агентом Ириной Спалько, похищают Мэрион Рэйвенвуд — давнюю возлюбленную Индианы Джонса, ставя профессора перед выбором: бездействие и смерть Мэрион или помощь советской разведке в поисках легендарного Хрустального черепа в обмен на свободу женщины.";"['фантастика', 'боевик', 'триллер', 'приключения']";['США'];"[22260, 'Стивен Спилберг']";"[[5679, 'Харрисон Форд'], [112, 'Кейт Бланшетт'], [2674, 'Карен Аллен'], [30162, 'Шайа ЛаБаф'], [3716, 'Рэй Уинстон'], [9331, 'Джон Хёрт'], [38704, 'Джим Бродбент'], [39495, 'Игорь Жижикин'], [27574, 'Дмитрий Дьяченко'], [29312, 'Илья Волох']]";6.848;6.2;6.6;185000000$;Индиана Джонс и Королевство хрустального черепа;Приключения;Фантастика;Поиски сокровищ;Современное кино (2000–2020);6.848;6.2;6.9;DB & CSV
61333;Сокровище нации;National Treasure 1;2004;12;131;https://avatars.mds.yandex.net/get-kinopoisk-image/4303601/c8b7c0a9-9711-4519-8c70-b5f23adca11c/600x900;"Современные охотники за сокровищами во главе с Беном Франклином Гейтсом узнают старинную легенду о сокровище, спрятанном еще отцами-основателями американского государства Джорджем Вашингтоном, Бенджамином Франклином и Томасом Джефферсоном.  Узнать тайну клада можно с помощью Декларации Независимости США, в которой зашифрована разгадка. Но помимо разгадывания изощренной головоломки, нашим героям предстоит сразиться с любителями легкой наживы, жаждущим погреть руки на достоянии республики…";"['боевик', 'триллер', 'детектив', 'приключения']";['США'];"[7035, 'Джон Тёртлтауб']";"[[6793, 'Николас Кейдж'], [34754, 'Дайан Крюгер'], [32272, 'Джастин Барта'], [28092, 'Шон Бин'], [515, 'Джон Войт'], [1600, 'Харви Кейтель'], [14847, 'Кристофер Пламмер'], [400271, 'Дэвид Дайан Фишер'], [79890, 'Стюарт Финлэй-Макленнан'], [724, 'Олег Тактаров']]";7.673;6.9;6.6;100000000$;Сокровище нации;Приключения;Исторический;Поиски сокровищ;Современное кино (2000–2020);7.673;6.9;5.3;DB & CSV
